,web_url,snippet,source,keywords,pub_date,word_count,headline.main,headline.kicker,headline.content_kicker,headline.print_headline,headline.name,headline.seo,headline.sub,byline.original,byline.person,byline.organization,title,Keywords
93,https://www.nytimes.com/2020/04/29/movies/a-secret-love-review.html,"This tender film explores the partnership between two women who lived, in public and to kin, as dear friends for six decades.",The New York Times,"[{'name': 'subject', 'value': 'Documentary Films and Programs', 'rank': 1, 'major': 'N'}, {'name': 'subject', 'value': 'Homosexuality and Bisexuality', 'rank': 2, 'major': 'N'}, {'name': 'persons', 'value': 'Bolan, Chris (Filmmaker)', 'rank': 3, 'major': 'N'}, {'name': 'creative_works', 'value': 'A Secret Love (Movie)', 'rank': 4, 'major': 'N'}]",2020-04-29T07:01:02+0000,309,‘A Secret Love’ Review: A Lesbian Couple’s Enduring Affection,,,Making a Haven of Their Own,,,,By Natalia Winkelman,"[{'firstname': 'Natalia', 'middlename': None, 'lastname': 'Winkelman', 'qualifier': None, 'title': None, 'role': 'reported', 'organization': '', 'rank': 1}]",,A Secret Love,"subject: Documentary Films and Programs;subject: Homosexuality and Bisexuality;persons: Bolan, Chris (Filmmaker);creative_works: A Secret Love (Movie);"
94,https://www.nytimes.com/2020/04/10/movies/love-wedding-repeat-review-a-tumble-down-the-aisle.html,A couple’s reception becomes a disaster (or does it?) in this comedy of multiple errors.,The New York Times,"[{'name': 'subject', 'value': 'Movies', 'rank': 1, 'major': 'N'}, {'name': 'creative_works', 'value': 'Love Wedding Repeat (Movie)', 'rank': 2, 'major': 'N'}, {'name': 'persons', 'value': 'Craig, Dean (1974- )', 'rank': 3, 'major': 'N'}, {'name': 'persons', 'value': 'Claflin, Sam', 'rank': 4, 'major': 'N'}, {'name': 'persons', 'value': 'Munn, Olivia', 'rank': 5, 'major': 'N'}]",2020-04-10T07:01:05+0000,414,‘Love Wedding Repeat’ Review: A Tumble Down the Aisle,Movie Review,,Pratfalling Down The Aisle,,,,By Amy Nicholson,"[{'firstname': 'Amy', 'middlename': None, 'lastname': 'Nicholson', 'qualifier': None, 'title': None, 'role': 'reported', 'organization': '', 'rank': 1}]",,Love Wedding Repeat,"subject: Movies;creative_works: Love Wedding Repeat (Movie);persons: Craig, Dean (1974- );persons: Claflin, Sam;persons: Munn, Olivia;"
95,https://www.nytimes.com/2020/04/02/movies/almost-love-review.html,This ensemble comedy treats class solidarity as the love that dare not speak its name.,The New York Times,"[{'name': 'subject', 'value': 'Movies', 'rank': 1, 'major': 'N'}, {'name': 'creative_works', 'value': 'Almost Love (Movie)', 'rank': 2, 'major': 'N'}, {'name': 'persons', 'value': 'Doyle, Mike (1972- )', 'rank': 3, 'major': 'N'}]",2020-04-02T11:00:03+0000,408,"‘Almost Love’ Review: Schooled in Romance, but Missing Class",,,"Schooled in Romance, but Missing Class",,,,By Teo Bugbee,"[{'firstname': 'Teo', 'middlename': None, 'lastname': 'Bugbee', 'qualifier': None, 'title': None, 'role': 'reported', 'organization': '', 'rank': 1}]",,Almost Love,"subject: Movies;creative_works: Almost Love (Movie);persons: Doyle, Mike (1972- );"
96,https://www.nytimes.com/2020/03/05/movies/hope-gap-review-a-thin-line-between-love-and-war.html,Annette Bening and Bill Nighy play a couple that has lost its way after 29 years of marriage.,The New York Times,"[{'name': 'subject', 'value': 'Movies', 'rank': 1, 'major': 'N'}, {'name': 'persons', 'value': 'Bening, Annette', 'rank': 2, 'major': 'N'}, {'name': 'persons', 'value': 'Nighy, Bill', 'rank': 3, 'major': 'N'}, {'name': 'persons', 'value': 'Nicholson, William (1948- )', 'rank': 4, 'major': 'N'}, {'name': 'creative_works', 'value': 'Hope Gap (Movie)', 'rank': 5, 'major': 'N'}]",2020-03-05T12:00:03+0000,257,‘Hope Gap’ Review: A Thin Line Between Love and War,,,Hope Gap,,,,By Aisha Harris,"[{'firstname': 'Aisha', 'middlename': None, 'lastname': 'Harris', 'qualifier': None, 'title': None, 'role': 'reported', 'organization': '', 'rank': 1}]",,Hope Gap,"subject: Movies;persons: Bening, Annette;persons: Nighy, Bill;persons: Nicholson, William (1948- );creative_works: Hope Gap (Movie);"
97,https://www.nytimes.com/2020/02/28/movies/all-the-bright-places-review.html,Elle Fanning and Justice Smith breathe life into a film about mental illness and the healing power of love.,The New York Times,"[{'name': 'subject', 'value': 'Movies', 'rank': 1, 'major': 'N'}, {'name': 'creative_works', 'value': 'All the Bright Places (Movie)', 'rank': 2, 'major': 'N'}, {'name': 'persons', 'value': 'Haley, Brett', 'rank': 3, 'major': 'N'}, {'name': 'persons', 'value': 'Fanning, Elle', 'rank': 4, 'major': 'N'}, {'name': 'persons', 'value': 'Smith, Justice (1995- )', 'rank': 5, 'major': 'N'}, {'name': 'organizations', 'value': 'Netflix Inc', 'rank': 6, 'major': 'N'}]",2020-02-28T08:01:07+0000,233,‘All the Bright Places’ Review: Love Amid Trauma,Streaming Movie Review,,A Refreshing Exploration of Mental Illness,,,,By Candice Frederick,"[{'firstname': 'Candice', 'middlename': None, 'lastname': 'Frederick', 'qualifier': None, 'title': None, 'role': 'reported', 'organization': '', 'rank': 1}]",,All the Bright Places,"subject: Movies;creative_works: All the Bright Places (Movie);persons: Haley, Brett;persons: Fanning, Elle;persons: Smith, Justice (1995- );organizations: Netflix Inc;"
98,https://www.nytimes.com/2020/02/13/movies/the-photograph-review.html,Issa Rae and a terrific Lakeith Stanfield play a New York couple whose romance sends them and the story into the past.,The New York Times,"[{'name': 'subject', 'value': 'Movies', 'rank': 1, 'major': 'N'}, {'name': 'creative_works', 'value': 'The Photograph (Movie)', 'rank': 2, 'major': 'N'}, {'name': 'persons', 'value': 'Meghie, Stella', 'rank': 3, 'major': 'N'}, {'name': 'persons', 'value': 'Rae, Issa', 'rank': 4, 'major': 'N'}, {'name': 'persons', 'value': 'Stanfield, Lakeith', 'rank': 5, 'major': 'N'}]",2020-02-13T20:54:33+0000,862,‘The Photograph’ Review: An Unabashedly Old-School Love Story,,,An Unabashedly Old-School Love Story,,,,By Manohla Dargis,"[{'firstname': 'Manohla', 'middlename': None, 'lastname': 'Dargis', 'qualifier': None, 'title': None, 'role': 'reported', 'organization': '', 'rank': 1}]",,The Photograph,"subject: Movies;creative_works: The Photograph (Movie);persons: Meghie, Stella;persons: Rae, Issa;persons: Stanfield, Lakeith;"
99,https://www.nytimes.com/2020/02/13/movies/you-go-to-my-head-review.html,A mysterious architect persuades an amnesiac that she’s his wife in this elusive romance set in the Sahara.,The New York Times,"[{'name': 'subject', 'value': 'Movies', 'rank': 1, 'major': 'N'}, {'name': 'creative_works', 'value': 'You Go to My Head (Movie)', 'rank': 2, 'major': 'N'}, {'name': 'persons', 'value': 'de Clercq, Dimitri', 'rank': 3, 'major': 'N'}]",2020-02-13T12:00:05+0000,292,‘You Go to My Head’ Review: Untrue Love,Critic’s Pick,,Designing a Love Story,,,,By Jeannette Catsoulis,"[{'firstname': 'Jeannette', 'middlename': None, 'lastname': 'Catsoulis', 'qualifier': None, 'title': None, 'role': 'reported', 'organization': '', 'rank': 1}]",,You Go to My Head,"subject: Movies;creative_works: You Go to My Head (Movie);persons: de Clercq, Dimitri;"
100,https://www.nytimes.com/2020/02/12/movies/ordinary-love-review.html,Lesley Manville and Liam Neeson play a married couple facing a cancer diagnosis.,The New York Times,"[{'name': 'subject', 'value': 'Movies', 'rank': 1, 'major': 'N'}, {'name': 'creative_works', 'value': 'Ordinary Love (Movie)', 'rank': 2, 'major': 'N'}, {'name': 'persons', 'value': 'Neeson, Liam', 'rank': 3, 'major': 'N'}, {'name': 'persons', 'value': 'Manville, Lesley', 'rank': 4, 'major': 'N'}, {'name': 'persons', 'value': ""D'Sa, Lisa Barros"", 'rank': 5, 'major': 'N'}, {'name': 'persons', 'value': 'Leyburn, Glenn', 'rank': 6, 'major': 'N'}]",2020-02-12T19:46:45+0000,569,‘Ordinary Love’ Review: In Sickness and in Health,,,Old-Sweater Lives,,,,By A.O. Scott,"[{'firstname': 'A.', 'middlename': 'O.', 'lastname': 'Scott', 'qualifier': None, 'title': None, 'role': 'reported', 'organization': '', 'rank': 1}]",,Ordinary Love,"subject: Movies;creative_works: Ordinary Love (Movie);persons: Neeson, Liam;persons: Manville, Lesley;persons: D'Sa, Lisa Barros;persons: Leyburn, Glenn;"
101,https://www.nytimes.com/2020/02/11/movies/to-all-the-boys-ps-i-still-love-you-review.html,The second installment in Netflix’s ’80s-style teen romance trilogy asks the question John Hughes left unanswered.,The New York Times,"[{'name': 'subject', 'value': 'Movies', 'rank': 1, 'major': 'N'}, {'name': 'persons', 'value': 'Condor, Lana', 'rank': 2, 'major': 'N'}, {'name': 'persons', 'value': 'Centineo, Noah', 'rank': 3, 'major': 'N'}, {'name': 'creative_works', 'value': 'To All the Boys: PS I Still Love You (Movie)', 'rank': 4, 'major': 'N'}, {'name': 'persons', 'value': 'Fimognari, Michael', 'rank': 5, 'major': 'N'}]",2020-02-11T18:33:41+0000,654,"‘To All the Boys: P.S. I Still Love You’ Review: Bliss, for Now",Streaming Movie Review,,"Follow Your Bliss While It Lasts, Kids",,,,By Amy Nicholson,"[{'firstname': 'Amy', 'middlename': None, 'lastname': 'Nicholson', 'qualifier': None, 'title': None, 'role': 'reported', 'organization': '', 'rank': 1}]",,To All the Boys: P.S. I Still Love You,"subject: Movies;persons: Condor, Lana;persons: Centineo, Noah;creative_works: To All the Boys: PS I Still Love You (Movie);persons: Fimognari, Michael;"
102,https://www.nytimes.com/2020/01/09/movies/the-woman-who-loves-giraffes-review.html,"This warm documentary uses one woman’s singular passion to fuel a tale of zoological discovery, blatant sexism and environmental alarm.",The New York Times,"[{'name': 'subject', 'value': 'Documentary Films and Programs', 'rank': 1, 'major': 'N'}, {'name': 'subject', 'value': 'Giraffes', 'rank': 2, 'major': 'N'}, {'name': 'creative_works', 'value': 'The Woman Who Loves Giraffes (Movie)', 'rank': 3, 'major': 'N'}, {'name': 'persons', 'value': 'Dagg, Anne Innis', 'rank': 4, 'major': 'N'}, {'name': 'persons', 'value': 'Reid, Alison (Filmmaker)', 'rank': 5, 'major': 'N'}]",2020-01-09T12:00:04+0000,279,‘The Woman Who Loves Giraffes’ Review: Crackers for Animals,,,A Special Spot  In Her Heart,,,,By Jeannette Catsoulis,"[{'firstname': 'Jeannette', 'middlename': None, 'lastname': 'Catsoulis', 'qualifier': None, 'title': None, 'role': 'reported', 'organization': '', 'rank': 1}]",,The Woman Who Loves Giraffes,"subject: Documentary Films and Programs;subject: Giraffes;creative_works: The Woman Who Loves Giraffes (Movie);persons: Dagg, Anne Innis;persons: Reid, Alison (Filmmaker);"
103,https://www.nytimes.com/2019/11/26/movies/queen-and-slim-review.html,Daniel Kaluuya and Jodie Turner-Smith star in Melina Matsoukas’s dreamy but intense outlaw romance.,The New York Times,"[{'name': 'subject', 'value': 'Movies', 'rank': 1, 'major': 'N'}, {'name': 'creative_works', 'value': 'Queen & Slim (Movie)', 'rank': 2, 'major': 'N'}, {'name': 'persons', 'value': 'Matsoukas, Melina', 'rank': 3, 'major': 'N'}, {'name': 'persons', 'value': 'Waithe, Lena', 'rank': 4, 'major': 'N'}, {'name': 'persons', 'value': 'Kaluuya, Daniel', 'rank': 5, 'major': 'N'}, {'name': 'persons', 'value': 'Turner-Smith, Jodie', 'rank': 6, 'major': 'N'}]",2019-11-26T17:41:50+0000,799,‘Queen & Slim’ Review: Love on the Run,critic’s pick,,Love Simmers Inside a Cauldron,,,,By A.O. Scott,"[{'firstname': 'A.', 'middlename': 'O.', 'lastname': 'Scott', 'qualifier': None, 'title': None, 'role': 'reported', 'organization': '', 'rank': 1}]",,Queen & Slim,"subject: Movies;creative_works: Queen & Slim (Movie);persons: Matsoukas, Melina;persons: Waithe, Lena;persons: Kaluuya, Daniel;persons: Turner-Smith, Jodie;"
104,https://www.nytimes.com/2019/11/05/movies/marriage-story-review.html,"Adam Driver and Scarlett Johansson self-consciously uncouple in Noah Baumbach’s tender, stinging tale of divorce.",The New York Times,"[{'name': 'subject', 'value': 'Movies', 'rank': 1, 'major': 'N'}, {'name': 'persons', 'value': 'Baumbach, Noah', 'rank': 2, 'major': 'N'}, {'name': 'creative_works', 'value': 'Marriage Story (Movie)', 'rank': 3, 'major': 'N'}, {'name': 'persons', 'value': 'Driver, Adam', 'rank': 4, 'major': 'N'}, {'name': 'persons', 'value': 'Johansson, Scarlett', 'rank': 5, 'major': 'N'}, {'name': 'persons', 'value': 'ALDA, ALAN', 'rank': 6, 'major': 'N'}, {'name': 'persons', 'value': 'Dern, Laura', 'rank': 7, 'major': 'N'}, {'name': 'persons', 'value': 'Liotta, Ray', 'rank': 8, 'major': 'N'}]",2019-11-05T19:01:02+0000,1244,‘Marriage Story’ Review: Dance Me to the End of Love,critic’s pick,,"Friendly Split, Shattering Break",,,,By A.O. Scott,"[{'firstname': 'A.', 'middlename': 'O.', 'lastname': 'Scott', 'qualifier': None, 'title': None, 'role': 'reported', 'organization': '', 'rank': 1}]",,Marriage Story,"subject: Movies;persons: Baumbach, Noah;creative_works: Marriage Story (Movie);persons: Driver, Adam;persons: Johansson, Scarlett;persons: ALDA, ALAN;persons: Dern, Laura;persons: Liotta, Ray;"
105,https://www.nytimes.com/2019/10/17/movies/cyrano-my-love-review.html,This superficial take on the writing and initial staging of “Cyrano de Bergerac” is a whirlwind of soapy declarations and backstage chaos.,The New York Times,"[{'name': 'subject', 'value': 'Movies', 'rank': 1, 'major': 'N'}, {'name': 'creative_works', 'value': 'Cyrano, My Love (Movie)', 'rank': 2, 'major': 'N'}, {'name': 'persons', 'value': 'Michalik, Alexis', 'rank': 3, 'major': 'N'}]",2019-10-17T11:00:03+0000,291,"‘Cyrano, My Love’ Review: A Nose for Romance",,,"Cyrano, My Love",,,,By Jeannette Catsoulis,"[{'firstname': 'Jeannette', 'middlename': None, 'lastname': 'Catsoulis', 'qualifier': None, 'title': None, 'role': 'reported', 'organization': '', 'rank': 1}]",,"Cyrano, My Love","subject: Movies;creative_works: Cyrano, My Love (Movie);persons: Michalik, Alexis;"
106,https://www.nytimes.com/2019/10/03/movies/pretenders-review.html,"Directed by James Franco and featuring James Franco, this film indulges in a distasteful brand of nostalgia.",The New York Times,"[{'name': 'subject', 'value': 'Movies', 'rank': 1, 'major': 'N'}, {'name': 'persons', 'value': 'Franco, James', 'rank': 2, 'major': 'N'}, {'name': 'creative_works', 'value': 'Pretenders (Movie)', 'rank': 3, 'major': 'N'}]",2019-10-03T11:00:07+0000,276,"‘Pretenders’ Review: A Little New Wave Love, a Lot of Misogyny",,,Pretenders,,,,By Glenn Kenny,"[{'firstname': 'Glenn', 'middlename': None, 'lastname': 'Kenny', 'qualifier': None, 'title': None, 'role': 'reported', 'organization': '', 'rank': 1}]",,Pretenders,"subject: Movies;persons: Franco, James;creative_works: Pretenders (Movie);"
107,https://www.nytimes.com/2019/09/26/movies/first-love-review.html,The prolific director Takashi Miike delivers an unusually satisfying Japanese genre romp.,The New York Times,"[{'name': 'subject', 'value': 'Movies', 'rank': 1, 'major': 'N'}, {'name': 'persons', 'value': 'Miike, Takashi', 'rank': 2, 'major': 'N'}, {'name': 'creative_works', 'value': 'First Love (Movie)', 'rank': 3, 'major': 'N'}]",2019-09-26T11:00:06+0000,398,‘First Love’ Review: Eluding Assassins With the Help of a Boxer,Critic’s Pick,,"Assassin Variations, by Way of Japan",,,,By Glenn Kenny,"[{'firstname': 'Glenn', 'middlename': None, 'lastname': 'Kenny', 'qualifier': None, 'title': None, 'role': 'reported', 'organization': '', 'rank': 1}]",,First Love,"subject: Movies;persons: Miike, Takashi;creative_works: First Love (Movie);"
108,https://www.nytimes.com/2019/09/19/movies/loro-review.html,Toni Servillo plays the former Italian Prime Minister Silvio Berlusconi in Paolo Sorrentino’s extravagant portrait.,The New York Times,"[{'name': 'subject', 'value': 'Movies', 'rank': 1, 'major': 'N'}, {'name': 'creative_works', 'value': 'Loro (Movie)', 'rank': 2, 'major': 'N'}, {'name': 'persons', 'value': 'Servillo, Toni', 'rank': 3, 'major': 'N'}, {'name': 'persons', 'value': 'Sorrentino, Paolo', 'rank': 4, 'major': 'N'}, {'name': 'persons', 'value': 'Berlusconi, Silvio', 'rank': 5, 'major': 'N'}, {'name': 'glocations', 'value': 'Italy', 'rank': 6, 'major': 'N'}]",2019-09-19T17:27:07+0000,820,"‘Loro’ Review: A Corrupt Leader, and the People Who Love Him",,,Corruption and Charisma Personified,,,,By A.O. Scott,"[{'firstname': 'A.', 'middlename': 'O.', 'lastname': 'Scott', 'qualifier': None, 'title': None, 'role': 'reported', 'organization': '', 'rank': 1}]",,Loro,"subject: Movies;creative_works: Loro (Movie);persons: Servillo, Toni;persons: Sorrentino, Paolo;persons: Berlusconi, Silvio;glocations: Italy;"
109,https://www.nytimes.com/2019/08/29/movies/falling-inn-love-review.html,"It’s hard to find a reliable, talented, reasonably priced, eco-friendly contractor these days.",The New York Times,"[{'name': 'subject', 'value': 'Movies', 'rank': 1, 'major': 'N'}, {'name': 'organizations', 'value': 'Netflix Inc', 'rank': 2, 'major': 'N'}, {'name': 'persons', 'value': 'Kumble, Roger', 'rank': 3, 'major': 'N'}, {'name': 'persons', 'value': 'Milian, Christina', 'rank': 4, 'major': 'N'}, {'name': 'persons', 'value': 'Demos, Adam', 'rank': 5, 'major': 'N'}, {'name': 'creative_works', 'value': 'Falling Inn Love (Movie)', 'rank': 6, 'major': 'N'}]",2019-08-29T14:56:44+0000,374,‘Falling Inn Love’ Review: A Prize That Needs Some Work,Streaming Movie Review,,A Fine Romance to Watch While Sorting Socks,,,,By Helen T. Verongos,"[{'firstname': 'Helen', 'middlename': 'T.', 'lastname': 'Verongos', 'qualifier': None, 'title': None, 'role': 'reported', 'organization': '', 'rank': 1}]",,Falling Inn Love,"subject: Movies;organizations: Netflix Inc;persons: Kumble, Roger;persons: Milian, Christina;persons: Demos, Adam;creative_works: Falling Inn Love (Movie);"
110,https://www.nytimes.com/2019/08/22/movies/hot-air-review.html,Steve Coogan stars in this cumbersome political comedy.,The New York Times,"[{'name': 'subject', 'value': 'Movies', 'rank': 1, 'major': 'N'}, {'name': 'persons', 'value': 'Coogan, Steve', 'rank': 2, 'major': 'N'}, {'name': 'persons', 'value': 'Coraci, Frank', 'rank': 3, 'major': 'N'}, {'name': 'creative_works', 'value': 'Hot Air (Movie)', 'rank': 4, 'major': 'N'}, {'name': 'persons', 'value': 'Campbell, Neve', 'rank': 5, 'major': 'N'}]",2019-08-22T15:50:09+0000,266,‘Hot Air’ Review: A Right-Wing Radio Host Learns to Love Again,,,Hot Air,,,,By Bilge Ebiri,"[{'firstname': 'Bilge', 'middlename': None, 'lastname': 'Ebiri', 'qualifier': None, 'title': None, 'role': 'reported', 'organization': '', 'rank': 1}]",,Hot Air,"subject: Movies;persons: Coogan, Steve;persons: Coraci, Frank;creative_works: Hot Air (Movie);persons: Campbell, Neve;"
111,https://www.nytimes.com/2019/08/08/movies/love-anthosa-review.html,"Anton Yelchin, who played Chekov in the J.J. Abrams-produced “Star Trek” films, assembled an eclectic filmography before his death at 27 in 2016.",The New York Times,"[{'name': 'subject', 'value': 'Documentary Films and Programs', 'rank': 1, 'major': 'N'}, {'name': 'creative_works', 'value': 'Love, Antosha (Movie)', 'rank': 2, 'major': 'N'}, {'name': 'persons', 'value': 'Price, Garret', 'rank': 3, 'major': 'N'}, {'name': 'persons', 'value': 'Yelchin, Anton', 'rank': 4, 'major': 'N'}]",2019-08-08T09:00:10+0000,319,"‘Love, Antosha’ Review: A Heartbreaking Look at an Actor’s Too-Short Life",Critic’s Pick,,"Love, Antosha",,,,By Glenn Kenny,"[{'firstname': 'Glenn', 'middlename': None, 'lastname': 'Kenny', 'qualifier': None, 'title': None, 'role': 'reported', 'organization': '', 'rank': 1}]",,"Love, Antosha","subject: Documentary Films and Programs;creative_works: Love, Antosha (Movie);persons: Price, Garret;persons: Yelchin, Anton;"
112,https://www.nytimes.com/2019/06/06/movies/leto-review.html,Kirill Serebrennikov’s gentle mood piece brings an underground music scene to vivid life.,The New York Times,"[{'name': 'subject', 'value': 'Music', 'rank': 1, 'major': 'N'}, {'name': 'creative_works', 'value': 'Leto (Movie)', 'rank': 2, 'major': 'N'}, {'name': 'persons', 'value': 'Serebrennikov, Kirill S', 'rank': 3, 'major': 'N'}]",2019-06-06T11:00:02+0000,283,‘Leto’ Review: Love and Rock in Leningrad,Critic’s Pick,,Leto,,,,By Jeannette Catsoulis,"[{'firstname': 'Jeannette', 'middlename': None, 'lastname': 'Catsoulis', 'qualifier': None, 'title': None, 'role': 'reported', 'organization': '', 'rank': 1}]",,Leto,"subject: Music;creative_works: Leto (Movie);persons: Serebrennikov, Kirill S;"
113,https://www.nytimes.com/2019/05/21/movies/the-tomorrow-man-review.html,Blythe Danner and John Lithgow strain to elevate this twee late-life romance.,The New York Times,"[{'name': 'subject', 'value': 'Movies', 'rank': 1, 'major': 'N'}, {'name': 'creative_works', 'value': 'The Tomorrow Man (Movie)', 'rank': 2, 'major': 'N'}, {'name': 'persons', 'value': 'Danner, Blythe', 'rank': 3, 'major': 'N'}, {'name': 'persons', 'value': 'Lithgow, John', 'rank': 4, 'major': 'N'}, {'name': 'persons', 'value': 'Jones, Noble', 'rank': 5, 'major': 'N'}]",2019-05-21T11:00:01+0000,280,‘The Tomorrow Man’ Review: Love Among the Neuroses,,,"They Whirl, They Twirl, They Tango",,,,By Jeannette Catsoulis,"[{'firstname': 'Jeannette', 'middlename': None, 'lastname': 'Catsoulis', 'qualifier': None, 'title': None, 'role': 'reported', 'organization': '', 'rank': 1}]",,The Tomorrow Man,"subject: Movies;creative_works: The Tomorrow Man (Movie);persons: Danner, Blythe;persons: Lithgow, John;persons: Jones, Noble;"
114,https://www.nytimes.com/2019/05/16/movies/asako-i-and-ii-review.html,The Japanese director Ryusuke Hamaguchi follows up his marathon “Happy Hour” with a story of love among young urbanites.,The New York Times,"[{'name': 'subject', 'value': 'Movies', 'rank': 1, 'major': 'N'}, {'name': 'creative_works', 'value': 'Asako I & II (Movie)', 'rank': 2, 'major': 'N'}, {'name': 'persons', 'value': 'Hamaguchi, Ryusuke', 'rank': 3, 'major': 'N'}]",2019-05-16T11:00:01+0000,547,‘Asako I & II’ Review: Double the Love (and the Heartbreak),Critic’s Pick,,Falling For a Drifter And His Lookalike,,,,By Glenn Kenny,"[{'firstname': 'Glenn', 'middlename': None, 'lastname': 'Kenny', 'qualifier': None, 'title': None, 'role': 'reported', 'organization': '', 'rank': 1}]",,Asako I & II,"subject: Movies;creative_works: Asako I & II (Movie);persons: Hamaguchi, Ryusuke;"
115,https://www.nytimes.com/2019/05/15/movies/the-sun-is-also-a-star-review.html,"Yara Shahidi and Charles Melton play teenagers falling in love on a hectic, sunny day in New York.",The New York Times,"[{'name': 'subject', 'value': 'Movies', 'rank': 1, 'major': 'N'}, {'name': 'creative_works', 'value': 'The Sun Is also a Star (Movie)', 'rank': 2, 'major': 'N'}, {'name': 'persons', 'value': 'Russo-Young, Ry', 'rank': 3, 'major': 'N'}, {'name': 'persons', 'value': 'Shahidi, Yara (2000- )', 'rank': 4, 'major': 'N'}, {'name': 'persons', 'value': 'Yoon, Nicola (Author)', 'rank': 5, 'major': 'N'}, {'name': 'persons', 'value': 'Melton, Charles (1991- )', 'rank': 6, 'major': 'N'}]",2019-05-15T16:01:27+0000,697,"‘The Sun Is Also a Star’ Review: A Charming, if Generic, Adolescent Love Story",,,A Beautiful Day for Young Hearts,,,,By A.O. Scott,"[{'firstname': 'A.', 'middlename': 'O.', 'lastname': 'Scott', 'qualifier': None, 'title': None, 'role': 'reported', 'organization': '', 'rank': 1}]",,The Sun Is Also a Star,"subject: Movies;creative_works: The Sun Is also a Star (Movie);persons: Russo-Young, Ry;persons: Shahidi, Yara (2000- );persons: Yoon, Nicola (Author);persons: Melton, Charles (1991- );"
116,https://www.nytimes.com/2019/05/10/movies/sheherazade-review.html,The options are few and most of them involve risk or further deprivation for these French teenagers who face the world with little support.,The New York Times,"[{'name': 'subject', 'value': 'Movies', 'rank': 1, 'major': 'N'}, {'name': 'organizations', 'value': 'Netflix Inc', 'rank': 2, 'major': 'N'}, {'name': 'creative_works', 'value': 'Sheherazade (Movie)', 'rank': 3, 'major': 'N'}, {'name': 'persons', 'value': 'Marlin, Jean-Bernard', 'rank': 4, 'major': 'N'}]",2019-05-10T11:00:01+0000,350,‘Shéhérazade’ Review: Love in the Mean Streets of Marseille,Streaming Movie Review,,,,,,By Helen T. Verongos,"[{'firstname': 'Helen', 'middlename': 'T.', 'lastname': 'Verongos', 'qualifier': None, 'title': None, 'role': 'reported', 'organization': '', 'rank': 1}]",,Shéhérazade,"subject: Movies;organizations: Netflix Inc;creative_works: Sheherazade (Movie);persons: Marlin, Jean-Bernard;"
117,https://www.nytimes.com/2019/05/02/movies/long-shot-review.html,The improbably yet perfectly paired stars play old friends who unexpectedly find love in this charming (and a bit vulgar) romantic comedy.,The New York Times,"[{'name': 'subject', 'value': 'Movies', 'rank': 1, 'major': 'N'}, {'name': 'subject', 'value': 'Comedy and Humor', 'rank': 2, 'major': 'N'}, {'name': 'persons', 'value': 'Odenkirk, Bob', 'rank': 3, 'major': 'N'}, {'name': 'persons', 'value': 'Rogen, Seth', 'rank': 4, 'major': 'N'}, {'name': 'persons', 'value': 'Theron, Charlize', 'rank': 5, 'major': 'N'}, {'name': 'creative_works', 'value': 'Long Shot (Movie)', 'rank': 6, 'major': 'N'}, {'name': 'persons', 'value': 'Levine, Jonathan A (1976- )', 'rank': 7, 'major': 'N'}]",2019-05-02T17:43:25+0000,1025,‘Long Shot’ Review: Charlize Theron and Seth Rogen Give Good Heart,Critic’s Pick,,Beating the Odds for Love and Bliss,,,,By Manohla Dargis,"[{'firstname': 'Manohla', 'middlename': None, 'lastname': 'Dargis', 'qualifier': None, 'title': None, 'role': 'reported', 'organization': '', 'rank': 1}]",,Long Shot,"subject: Movies;subject: Comedy and Humor;persons: Odenkirk, Bob;persons: Rogen, Seth;persons: Theron, Charlize;creative_works: Long Shot (Movie);persons: Levine, Jonathan A (1976- );"
