,web_url,snippet,source,keywords,pub_date,word_count,headline.main,headline.kicker,headline.content_kicker,headline.print_headline,headline.name,headline.seo,headline.sub,byline.original,byline.person,byline.organization,title,Keywords
47,https://www.nytimes.com/2021/12/23/movies/a-journal-for-jordan-review.html,The actors Michael B. Jordan and Chanté Adams bring a compelling chemistry to the screen as opposites who fall for each other.,The New York Times,"[{'name': 'subject', 'value': 'Movies', 'rank': 1, 'major': 'N'}, {'name': 'creative_works', 'value': 'A Journal for Jordan (Movie)', 'rank': 2, 'major': 'N'}, {'name': 'persons', 'value': 'Washington, Denzel', 'rank': 3, 'major': 'N'}, {'name': 'persons', 'value': 'Jordan, Michael B', 'rank': 4, 'major': 'N'}, {'name': 'persons', 'value': 'Adams, Chante', 'rank': 5, 'major': 'N'}, {'name': 'subject', 'value': 'Books and Literature', 'rank': 6, 'major': 'N'}, {'name': 'creative_works', 'value': 'A Journal for Jordan: A Story of Love and Honor (Book)', 'rank': 7, 'major': 'N'}, {'name': 'persons', 'value': 'Canedy, Dana', 'rank': 8, 'major': 'N'}, {'name': 'subject', 'value': 'Black People', 'rank': 9, 'major': 'N'}, {'name': 'subject', 'value': 'Blacks', 'rank': 10, 'major': 'N'}]",2021-12-23T18:54:12+0000,505,‘A Journal for Jordan’ Review: Reflections on Love Built and Lost,,,Reflections on Love That’s Built and Lost,,,,By Lisa Kennedy,"[{'firstname': 'Lisa', 'middlename': None, 'lastname': 'Kennedy', 'qualifier': None, 'title': None, 'role': 'reported', 'organization': '', 'rank': 1}]",,A Journal for Jordan,"subject: Movies;creative_works: A Journal for Jordan (Movie);persons: Washington, Denzel;persons: Jordan, Michael B;persons: Adams, Chante;subject: Books and Literature;creative_works: A Journal for Jordan: A Story of Love and Honor (Book);persons: Canedy, Dana;subject: Black People;subject: Blacks;"
48,https://www.nytimes.com/2021/12/08/movies/west-side-story-review.html,"Steven Spielberg rediscovers the breathing, troubling essence of a classic, building a bold and current screen musical with no pretense to perfection.",The New York Times,"[{'name': 'subject', 'value': 'Movies', 'rank': 1, 'major': 'N'}, {'name': 'subject', 'value': 'Theater', 'rank': 2, 'major': 'N'}, {'name': 'persons', 'value': 'Alvarez, David (1994- )', 'rank': 3, 'major': 'N'}, {'name': 'persons', 'value': 'Bernstein, Leonard', 'rank': 4, 'major': 'N'}, {'name': 'persons', 'value': 'DeBose, Ariana', 'rank': 5, 'major': 'N'}, {'name': 'persons', 'value': 'Kushner, Tony', 'rank': 6, 'major': 'N'}, {'name': 'persons', 'value': 'Laurents, Arthur', 'rank': 7, 'major': 'N'}, {'name': 'persons', 'value': 'Peck, Justin', 'rank': 8, 'major': 'N'}, {'name': 'persons', 'value': 'Robbins, Jerome', 'rank': 9, 'major': 'N'}, {'name': 'persons', 'value': 'Sondheim, Stephen', 'rank': 10, 'major': 'N'}, {'name': 'persons', 'value': 'Spielberg, Steven', 'rank': 11, 'major': 'N'}, {'name': 'persons', 'value': 'Tesori, Jeanine', 'rank': 12, 'major': 'N'}, {'name': 'glocations', 'value': 'New York City', 'rank': 13, 'major': 'N'}, {'name': 'creative_works', 'value': 'West Side Story (2021) (Movie)', 'rank': 14, 'major': 'N'}]",2021-12-08T14:55:30+0000,1316,"‘West Side Story’ Review: In Love and War, 1957 Might Be Tonight",Critic’s Pick,,"Meeting a Girl Named Maria, Again",,,,By A.O. Scott,"[{'firstname': 'A.', 'middlename': 'O.', 'lastname': 'Scott', 'qualifier': None, 'title': None, 'role': 'reported', 'organization': '', 'rank': 1}]",,West Side Story,"subject: Movies;subject: Theater;persons: Alvarez, David (1994- );persons: Bernstein, Leonard;persons: DeBose, Ariana;persons: Kushner, Tony;persons: Laurents, Arthur;persons: Peck, Justin;persons: Robbins, Jerome;persons: Sondheim, Stephen;persons: Spielberg, Steven;persons: Tesori, Jeanine;glocations: New York City;creative_works: West Side Story (2021) (Movie);"
49,https://www.nytimes.com/2021/11/16/movies/aulcie-review.html,"This melodramatic documentary chronicles how Aulcie Perry, a basketball center from New Jersey, became a celebrity in Israel after he joined the Maccabi Tel Aviv team.",The New York Times,"[{'name': 'subject', 'value': 'Documentary Films and Programs', 'rank': 1, 'major': 'N'}, {'name': 'subject', 'value': 'Basketball', 'rank': 2, 'major': 'N'}, {'name': 'persons', 'value': 'Menkin, Dani', 'rank': 3, 'major': 'N'}, {'name': 'persons', 'value': 'Perry, Aulcie', 'rank': 4, 'major': 'N'}, {'name': 'creative_works', 'value': 'Aulcie (Movie)', 'rank': 5, 'major': 'N'}, {'name': 'glocations', 'value': 'Israel', 'rank': 6, 'major': 'N'}]",2021-11-16T21:35:40+0000,259,"‘Aulcie’ Review: Love and Basketball, in Israel",,,Aulcie,,,,By Natalia Winkelman,"[{'firstname': 'Natalia', 'middlename': None, 'lastname': 'Winkelman', 'qualifier': None, 'title': None, 'role': 'reported', 'organization': '', 'rank': 1}]",,Aulcie,"subject: Documentary Films and Programs;subject: Basketball;persons: Menkin, Dani;persons: Perry, Aulcie;creative_works: Aulcie (Movie);glocations: Israel;"
50,https://www.nytimes.com/2021/11/11/movies/love-is-love-is-love-review.html,"The characters in this idle drama, directed by Eleanor Coppola, seem mostly content. That’s the problem.",The New York Times,"[{'name': 'subject', 'value': 'Movies', 'rank': 1, 'major': 'N'}, {'name': 'persons', 'value': 'Coppola, Eleanor', 'rank': 2, 'major': 'N'}, {'name': 'persons', 'value': 'Arquette, Rosanna', 'rank': 3, 'major': 'N'}, {'name': 'persons', 'value': 'Shepherd, Cybill', 'rank': 4, 'major': 'N'}, {'name': 'persons', 'value': 'Wilson, Rita', 'rank': 5, 'major': 'N'}, {'name': 'creative_works', 'value': 'Love Is Love Is Love (Movie)', 'rank': 6, 'major': 'N'}]",2021-11-11T12:00:06+0000,292,‘Love Is Love Is Love’ Review: Aging Too Gracefully,,,Love Is Love Is Love,,,,By Teo Bugbee,"[{'firstname': 'Teo', 'middlename': None, 'lastname': 'Bugbee', 'qualifier': None, 'title': None, 'role': 'reported', 'organization': '', 'rank': 1}]",,Love Is Love Is Love,"subject: Movies;persons: Coppola, Eleanor;persons: Arquette, Rosanna;persons: Shepherd, Cybill;persons: Wilson, Rita;creative_works: Love Is Love Is Love (Movie);"
51,https://www.nytimes.com/2021/11/05/movies/love-hard-review.html,"When a perennially single journalist travels across the country to meet her dream guy, she finds she’s been catfished.",The New York Times,"[{'name': 'subject', 'value': 'Movies', 'rank': 1, 'major': 'N'}, {'name': 'creative_works', 'value': 'Love Hard (Movie)', 'rank': 2, 'major': 'N'}, {'name': 'persons', 'value': 'Jimenez, Hernan', 'rank': 3, 'major': 'N'}]",2021-11-05T07:01:03+0000,343,"‘Love Hard’ Review: Seeking Connection, Not Perfection",,,Love Hard,,,,By Concepción de León,"[{'firstname': 'Concepción', 'middlename': None, 'lastname': 'de León', 'qualifier': None, 'title': None, 'role': 'reported', 'organization': '', 'rank': 1}]",,Love Hard,"subject: Movies;creative_works: Love Hard (Movie);persons: Jimenez, Hernan;"
52,https://www.nytimes.com/2021/10/14/movies/bergman-island-review.html,"In Mia Hansen-Love’s new film, Vicky Krieps and Tim Roth play filmmakers on the rocks in the Baltic Sea.",The New York Times,"[{'name': 'subject', 'value': 'Movies', 'rank': 1, 'major': 'N'}, {'name': 'persons', 'value': 'Bergman, Ingmar', 'rank': 2, 'major': 'N'}, {'name': 'persons', 'value': 'Roth, Tim', 'rank': 3, 'major': 'N'}, {'name': 'persons', 'value': 'Wasikowska, Mia', 'rank': 4, 'major': 'N'}, {'name': 'persons', 'value': 'Hansen-Love, Mia', 'rank': 5, 'major': 'N'}, {'name': 'creative_works', 'value': 'Bergman Island (Movie)', 'rank': 6, 'major': 'N'}, {'name': 'persons', 'value': 'Krieps, Vicky', 'rank': 7, 'major': 'N'}]",2021-10-14T16:00:06+0000,888,‘Bergman Island’ Review: Love Among the Cinephiles,critic’s pick,,Scenes From Not Quite a Marriage,,,,By A.O. Scott,"[{'firstname': 'A.', 'middlename': 'O.', 'lastname': 'Scott', 'qualifier': None, 'title': None, 'role': 'reported', 'organization': '', 'rank': 1}]",,Bergman Island,"subject: Movies;persons: Bergman, Ingmar;persons: Roth, Tim;persons: Wasikowska, Mia;persons: Hansen-Love, Mia;creative_works: Bergman Island (Movie);persons: Krieps, Vicky;"
53,https://www.nytimes.com/2021/10/14/movies/hard-luck-love-song-review.html,"Drawn from the plotline of a Todd Snider song, the film follows a pool shark and an escort, taking twists that are both violent and silly.",The New York Times,"[{'name': 'subject', 'value': 'Movies', 'rank': 1, 'major': 'N'}, {'name': 'persons', 'value': 'Dorman, Michael (1981- )', 'rank': 2, 'major': 'N'}, {'name': 'creative_works', 'value': 'Hard Luck Love Song (Movie)', 'rank': 3, 'major': 'N'}, {'name': 'persons', 'value': 'Bush, Sophia (1982- )', 'rank': 4, 'major': 'N'}]",2021-10-14T12:27:03+0000,320,‘Hard Luck Love Song’ Review: A Glossy Take on a Gritty Tune,,,Hard Luck Love Song,,,,By Glenn Kenny,"[{'firstname': 'Glenn', 'middlename': None, 'lastname': 'Kenny', 'qualifier': None, 'title': None, 'role': 'reported', 'organization': '', 'rank': 1}]",,Hard Luck Love Song,"subject: Movies;persons: Dorman, Michael (1981- );creative_works: Hard Luck Love Song (Movie);persons: Bush, Sophia (1982- );"
54,https://www.nytimes.com/2021/10/07/movies/south-of-heaven-review.html,Jason Sudeikis plays a paroled felon who vows to give his dying lover the best year of her life.,The New York Times,"[{'name': 'subject', 'value': 'Movies', 'rank': 1, 'major': 'N'}, {'name': 'persons', 'value': 'Sudeikis, Jason', 'rank': 2, 'major': 'N'}, {'name': 'persons', 'value': 'Lilly, Evangeline (1979- )', 'rank': 3, 'major': 'N'}, {'name': 'persons', 'value': 'Keshales, Aharon', 'rank': 4, 'major': 'N'}, {'name': 'creative_works', 'value': 'South of Heaven (Movie)', 'rank': 5, 'major': 'N'}]",2021-10-07T17:17:19+0000,323,‘South of Heaven’ Review: Anything for Love,,,South of Heaven,,,,By Amy Nicholson,"[{'firstname': 'Amy', 'middlename': None, 'lastname': 'Nicholson', 'qualifier': None, 'title': None, 'role': 'reported', 'organization': '', 'rank': 1}]",,South of Heaven,"subject: Movies;persons: Sudeikis, Jason;persons: Lilly, Evangeline (1979- );persons: Keshales, Aharon;creative_works: South of Heaven (Movie);"
55,https://www.nytimes.com/2021/09/16/movies/wife-of-a-spy-review-trust-or-fear-in-love-and-war.html,"In this latest work by Kiyoshi Kurosawa, a Japanese couple’s relationship is shaped by the forces of churning nationalism that surround it.",The New York Times,"[{'name': 'subject', 'value': 'Movies', 'rank': 1, 'major': 'N'}, {'name': 'persons', 'value': 'Kurosawa, Kiyoshi', 'rank': 2, 'major': 'N'}, {'name': 'creative_works', 'value': 'Wife of a Spy (Movie)', 'rank': 3, 'major': 'N'}]",2021-09-16T11:00:07+0000,448,‘Wife of a Spy’ Review: Trust or Fear in Love and War?,Critic’s Pick,,Marriage Amid Nationalism,,,,By Glenn Kenny,"[{'firstname': 'Glenn', 'middlename': None, 'lastname': 'Kenny', 'qualifier': None, 'title': None, 'role': 'reported', 'organization': '', 'rank': 1}]",,Wife of a Spy,"subject: Movies;persons: Kurosawa, Kiyoshi;creative_works: Wife of a Spy (Movie);"
56,https://www.nytimes.com/2021/09/02/movies/happier-than-ever-review.html,"In the Disney+ concert film “Happier Than Ever: A Love Letter to Los Angeles,” the pop star Billie Eilish pays tribute to the star-struck hauntedness of that city.",The New York Times,"[{'name': 'subject', 'value': 'Documentary Films and Programs', 'rank': 1, 'major': 'N'}, {'name': 'subject', 'value': 'Music', 'rank': 2, 'major': 'N'}, {'name': 'persons', 'value': 'Eilish, Billie', 'rank': 3, 'major': 'N'}, {'name': 'persons', 'value': 'Rodriguez, Robert', 'rank': 4, 'major': 'N'}, {'name': 'creative_works', 'value': 'Happier Than Ever: A Love Letter to Los Angeles (Movie)', 'rank': 5, 'major': 'N'}, {'name': 'persons', 'value': 'Osborne, Patrick (Film Director)', 'rank': 6, 'major': 'N'}, {'name': 'glocations', 'value': 'Los Angeles (Calif)', 'rank': 7, 'major': 'N'}]",2021-09-02T11:00:07+0000,302,‘Happier Than Ever’ Review: Modern Pop Meets Classic Hollywood,,,Happier Than Ever:  A Love Letter  to Los Angeles,,,,By Teo Bugbee,"[{'firstname': 'Teo', 'middlename': None, 'lastname': 'Bugbee', 'qualifier': None, 'title': None, 'role': 'reported', 'organization': '', 'rank': 1}]",,Happier Than Ever,"subject: Documentary Films and Programs;subject: Music;persons: Eilish, Billie;persons: Rodriguez, Robert;creative_works: Happier Than Ever: A Love Letter to Los Angeles (Movie);persons: Osborne, Patrick (Film Director);glocations: Los Angeles (Calif);"
57,https://www.nytimes.com/2021/08/26/movies/together-review.html,Sharon Horgan and James McAvoy play a battling couple trapped in lockdown in this theatrical pandemic drama.,The New York Times,"[{'name': 'subject', 'value': 'Movies', 'rank': 1, 'major': 'N'}, {'name': 'creative_works', 'value': 'Together (Movie)', 'rank': 2, 'major': 'N'}, {'name': 'persons', 'value': 'Daldry, Stephen', 'rank': 3, 'major': 'N'}, {'name': 'persons', 'value': 'McAvoy, James', 'rank': 4, 'major': 'N'}, {'name': 'persons', 'value': 'Horgan, Sharon (1970- )', 'rank': 5, 'major': 'N'}]",2021-08-26T11:00:06+0000,412,‘Together’ Review: Love and Loathing in London,,,Love and Loathing in a Blighted London,,,,By Jeannette Catsoulis,"[{'firstname': 'Jeannette', 'middlename': None, 'lastname': 'Catsoulis', 'qualifier': None, 'title': None, 'role': 'reported', 'organization': '', 'rank': 1}]",,Together,"subject: Movies;creative_works: Together (Movie);persons: Daldry, Stephen;persons: McAvoy, James;persons: Horgan, Sharon (1970- );"
58,https://www.nytimes.com/2021/08/05/movies/annette-review.html,"Adam Driver and Marion Cotillard are star-crossed lovers in this hallucinatory musical, written by Sparks and directed by Leos Carax.",The New York Times,"[{'name': 'subject', 'value': 'Movies', 'rank': 1, 'major': 'N'}, {'name': 'persons', 'value': 'Carax, Leos', 'rank': 2, 'major': 'N'}, {'name': 'persons', 'value': 'Cotillard, Marion', 'rank': 3, 'major': 'N'}, {'name': 'persons', 'value': 'Driver, Adam', 'rank': 4, 'major': 'N'}, {'name': 'persons', 'value': 'Mael, Ron', 'rank': 5, 'major': 'N'}, {'name': 'persons', 'value': 'Mael, Russell', 'rank': 6, 'major': 'N'}, {'name': 'creative_works', 'value': 'Annette (Movie)', 'rank': 7, 'major': 'N'}, {'name': 'organizations', 'value': 'Sparks (Music Group)', 'rank': 8, 'major': 'N'}]",2021-08-05T11:00:07+0000,1069,‘Annette’ Review: Love Hurts,Critic’s Pick,,A Star Is Born. You Won’t Like Him.,,,,By A.O. Scott,"[{'firstname': 'A.', 'middlename': 'O.', 'lastname': 'Scott', 'qualifier': None, 'title': None, 'role': 'reported', 'organization': '', 'rank': 1}]",,Annette,"subject: Movies;persons: Carax, Leos;persons: Cotillard, Marion;persons: Driver, Adam;persons: Mael, Ron;persons: Mael, Russell;creative_works: Annette (Movie);organizations: Sparks (Music Group);"
59,https://www.nytimes.com/2021/07/29/movies/resort-to-love-review.html,"In this romantic comedy, a woman reeling from a failed engagement and a flailing career escapes to a glamorous island resort.",The New York Times,"[{'name': 'subject', 'value': 'Movies', 'rank': 1, 'major': 'N'}, {'name': 'persons', 'value': 'Milian, Christina', 'rank': 2, 'major': 'N'}, {'name': 'creative_works', 'value': 'Resort to Love (Movie)', 'rank': 3, 'major': 'N'}, {'name': 'persons', 'value': 'Tsuchida, Steven', 'rank': 4, 'major': 'N'}]",2021-07-29T11:00:07+0000,310,‘Resort to Love’ Review: A Struggling Singer in Paradise,,,"Her Ex Returns, With His Bride-to-Be",,,,By Concepción de León,"[{'firstname': 'Concepción', 'middlename': None, 'lastname': 'de León', 'qualifier': None, 'title': None, 'role': 'reported', 'organization': '', 'rank': 1}]",,Resort to Love,"subject: Movies;persons: Milian, Christina;creative_works: Resort to Love (Movie);persons: Tsuchida, Steven;"
60,https://www.nytimes.com/2021/07/23/movies/woodstock-99-peace-love-and-rage-review.html,An HBO documentary examines a music festival that went so far off the rails that it defined an era.,The New York Times,"[{'name': 'subject', 'value': 'Documentary Films and Programs', 'rank': 1, 'major': 'N'}, {'name': 'persons', 'value': 'Price, Garret', 'rank': 2, 'major': 'N'}, {'name': 'creative_works', 'value': 'Woodstock 99: Peace, Love and Rage (Movie)', 'rank': 3, 'major': 'N'}, {'name': 'subject', 'value': 'Woodstock Music Festivals', 'rank': 4, 'major': 'N'}]",2021-07-23T11:00:05+0000,418,"‘Woodstock 99: Peace, Love and Rage’ Review: How a Festival Went Wrong",Critic’s Pick,,"Three Days of Violence, Misogyny and $4 Water",,,,By Elisabeth Vincentelli,"[{'firstname': 'Elisabeth', 'middlename': None, 'lastname': 'Vincentelli', 'qualifier': None, 'title': None, 'role': 'reported', 'organization': '', 'rank': 1}]",,"Woodstock 99: Peace, Love and Rage","subject: Documentary Films and Programs;persons: Price, Garret;creative_works: Woodstock 99: Peace, Love and Rage (Movie);subject: Woodstock Music Festivals;"
61,https://www.nytimes.com/2021/07/14/movies/casanova-last-love-review-reappraising-a-philanderer.html,Benoît Jacquot’s erotic costume drama envisions the Italian playboy as a weathered sad sack living in exile.,The New York Times,"[{'name': 'subject', 'value': 'Movies', 'rank': 1, 'major': 'N'}, {'name': 'persons', 'value': 'Jacquot, Benoit', 'rank': 2, 'major': 'N'}, {'name': 'creative_works', 'value': 'Casanova, Last Love (Movie)', 'rank': 3, 'major': 'N'}]",2021-07-14T22:12:43+0000,312,"‘Casanova, Last Love’ Review: Reappraising a Philanderer",,,"Casanova, Last Love",,,,By Beatrice Loayza,"[{'firstname': 'Beatrice', 'middlename': None, 'lastname': 'Loayza', 'qualifier': None, 'title': None, 'role': 'reported', 'organization': '', 'rank': 1}]",,"Casanova, Last Love","subject: Movies;persons: Jacquot, Benoit;creative_works: Casanova, Last Love (Movie);"
62,https://www.nytimes.com/2021/07/08/movies/running-against-the-wind-review.html,Two childhood best friends reunite in this unfocused yet uplifting sports drama by the filmmaker Jan Philipp Weyl.,The New York Times,"[{'name': 'subject', 'value': 'Movies', 'rank': 1, 'major': 'N'}, {'name': 'creative_works', 'value': 'Running Against the Wind (Movie)', 'rank': 2, 'major': 'N'}, {'name': 'persons', 'value': 'Weyl, Jan Philipp', 'rank': 3, 'major': 'N'}]",2021-07-08T11:00:05+0000,342,‘Running Against the Wind’ Review: Love and Friendship in Addis Ababa,,,Running Against the Wind,,,,By Beatrice Loayza,"[{'firstname': 'Beatrice', 'middlename': None, 'lastname': 'Loayza', 'qualifier': None, 'title': None, 'role': 'reported', 'organization': '', 'rank': 1}]",,Running Against the Wind,"subject: Movies;creative_works: Running Against the Wind (Movie);persons: Weyl, Jan Philipp;"
63,https://www.nytimes.com/2021/06/10/movies/asia-review.html,This drama about a young single mother and a terminally ill daughter avoids sentimentalism but indulges heavily in dourness.,The New York Times,"[{'name': 'subject', 'value': 'Movies', 'rank': 1, 'major': 'N'}, {'name': 'persons', 'value': 'Haas, Shira', 'rank': 2, 'major': 'N'}, {'name': 'persons', 'value': 'Pribar, Ruthy', 'rank': 3, 'major': 'N'}, {'name': 'persons', 'value': 'Yiv, Alena', 'rank': 4, 'major': 'N'}]",2021-06-10T11:00:15+0000,290,‘Asia’ Review: Tough Love and an Indecent Proposal,,,Asia,,,,By Devika Girish,"[{'firstname': 'Devika', 'middlename': None, 'lastname': 'Girish', 'qualifier': None, 'title': None, 'role': 'reported', 'organization': '', 'rank': 1}]",,Asia,"subject: Movies;persons: Haas, Shira;persons: Pribar, Ruthy;persons: Yiv, Alena;"
64,https://www.nytimes.com/2021/06/03/movies/undine-review.html,"Paula Beer and Franz Rogowski, who made an impression in 2019’s “Transit,” are reunited by the director Christian Petzold for this adaptation of a European myth.",The New York Times,"[{'name': 'subject', 'value': 'Movies', 'rank': 1, 'major': 'N'}, {'name': 'persons', 'value': 'Petzold, Christian', 'rank': 2, 'major': 'N'}, {'name': 'persons', 'value': 'Rogowski, Franz', 'rank': 3, 'major': 'N'}, {'name': 'creative_works', 'value': 'Undine (Movie)', 'rank': 4, 'major': 'N'}, {'name': 'persons', 'value': 'Beer, Paula (1995- )', 'rank': 5, 'major': 'N'}]",2021-06-03T11:00:08+0000,535,‘Undine’ Review: Love In and Out of the Water,Critic’s Pick,,She’s Like a Sprite Out of Water,,,,By Glenn Kenny,"[{'firstname': 'Glenn', 'middlename': None, 'lastname': 'Kenny', 'qualifier': None, 'title': None, 'role': 'reported', 'organization': '', 'rank': 1}]",,Undine,"subject: Movies;persons: Petzold, Christian;persons: Rogowski, Franz;creative_works: Undine (Movie);persons: Beer, Paula (1995- );"
65,https://www.nytimes.com/2021/05/20/movies/this-town-review.html,This small-town comedy from New Zealand looks at the romance between a country girl and a man accused of killing his family.,The New York Times,"[{'name': 'subject', 'value': 'Movies', 'rank': 1, 'major': 'N'}, {'name': 'creative_works', 'value': 'This Town (Movie)', 'rank': 2, 'major': 'N'}, {'name': 'persons', 'value': 'White, David (Director)', 'rank': 3, 'major': 'N'}]",2021-05-20T20:19:17+0000,287,‘This Town’ Review: Love and Rifles,,,This Town,,,,By Devika Girish,"[{'firstname': 'Devika', 'middlename': None, 'lastname': 'Girish', 'qualifier': None, 'title': None, 'role': 'reported', 'organization': '', 'rank': 1}]",,This Town,"subject: Movies;creative_works: This Town (Movie);persons: White, David (Director);"
66,https://www.nytimes.com/2021/04/22/movies/tu-me-manques-review.html,A conservative father who could not accept his son’s sexuality is led on a contemplative tour of queer life in New York in this Bolivian film.,The New York Times,"[{'name': 'subject', 'value': 'Movies', 'rank': 1, 'major': 'N'}, {'name': 'creative_works', 'value': 'Tu Me Manques (Movie)', 'rank': 2, 'major': 'N'}, {'name': 'persons', 'value': 'Martinez, Oscar (1949- )', 'rank': 3, 'major': 'N'}, {'name': 'persons', 'value': 'Barbosa, Fernando (Actor)', 'rank': 4, 'major': 'N'}, {'name': 'persons', 'value': 'Bellott, Rodrigo', 'rank': 5, 'major': 'N'}, {'name': 'glocations', 'value': 'Bolivia', 'rank': 6, 'major': 'N'}]",2021-04-22T11:00:07+0000,301,‘Tu Me Manques’ Review: Traces of a Lost Love,,,Tu Me Manques,,,,By Teo Bugbee,"[{'firstname': 'Teo', 'middlename': None, 'lastname': 'Bugbee', 'qualifier': None, 'title': None, 'role': 'reported', 'organization': '', 'rank': 1}]",,Tu Me Manques,"subject: Movies;creative_works: Tu Me Manques (Movie);persons: Martinez, Oscar (1949- );persons: Barbosa, Fernando (Actor);persons: Bellott, Rodrigo;glocations: Bolivia;"
67,https://www.nytimes.com/2021/04/15/movies/monday-review.html,"Fiery physical contact keeps an expat couple together in Greece, and the sex scenes are enough for a half-dozen movies.",The New York Times,"[{'name': 'subject', 'value': 'Movies', 'rank': 1, 'major': 'N'}, {'name': 'persons', 'value': 'Papadimitropoulos, Argyris', 'rank': 2, 'major': 'N'}, {'name': 'persons', 'value': 'Stan, Sebastian', 'rank': 3, 'major': 'N'}, {'name': 'persons', 'value': 'Gough, Denise (1980- )', 'rank': 4, 'major': 'N'}, {'name': 'creative_works', 'value': 'Monday (Movie)', 'rank': 5, 'major': 'N'}]",2021-04-15T11:00:08+0000,349,‘Monday’ Review: A Year of Love and Its Hangovers,,,Monday,,,,By Glenn Kenny,"[{'firstname': 'Glenn', 'middlename': None, 'lastname': 'Kenny', 'qualifier': None, 'title': None, 'role': 'reported', 'organization': '', 'rank': 1}]",,Monday,"subject: Movies;persons: Papadimitropoulos, Argyris;persons: Stan, Sebastian;persons: Gough, Denise (1980- );creative_works: Monday (Movie);"
68,https://www.nytimes.com/2021/04/15/movies/ride-or-die-review.html,"After upending her life, a woman runs away with her longtime crush in this puzzling Japanese drama.",The New York Times,"[{'name': 'subject', 'value': 'Movies', 'rank': 1, 'major': 'N'}, {'name': 'creative_works', 'value': 'Ride or Die (Movie)', 'rank': 2, 'major': 'N'}, {'name': 'persons', 'value': 'Hiroki, Ryuichi', 'rank': 3, 'major': 'N'}]",2021-04-15T11:00:03+0000,338,‘Ride or Die’ Review: Killing for Love,,,This Is Somehow a Love That’s Worth Killing For,,,,By Natalia Winkelman,"[{'firstname': 'Natalia', 'middlename': None, 'lastname': 'Winkelman', 'qualifier': None, 'title': None, 'role': 'reported', 'organization': '', 'rank': 1}]",,Ride or Die,"subject: Movies;creative_works: Ride or Die (Movie);persons: Hiroki, Ryuichi;"
69,https://www.nytimes.com/2021/04/09/movies/future-people-review.html,This documentary chronicles eight years in the lives of a group of children who form a bond after discovering they were conceived by the same sperm donor.,The New York Times,"[{'name': 'subject', 'value': 'Documentary Films and Programs', 'rank': 1, 'major': 'N'}, {'name': 'creative_works', 'value': 'Future People: The Family of Donor 5114 (Movie)', 'rank': 2, 'major': 'N'}, {'name': 'subject', 'value': 'ARTIFICIAL INSEMINATION', 'rank': 3, 'major': 'N'}, {'name': 'subject', 'value': 'Children and Childhood', 'rank': 4, 'major': 'N'}, {'name': 'persons', 'value': 'Rothman, Michael (Filmmaker)', 'rank': 5, 'major': 'N'}]",2021-04-09T11:00:04+0000,317,"‘Future People’ Review: Connected by Biology, Bonded by Love",,,So Many Siblings  Seeking One Another,,,,By Natalia Winkelman,"[{'firstname': 'Natalia', 'middlename': None, 'lastname': 'Winkelman', 'qualifier': None, 'title': None, 'role': 'reported', 'organization': '', 'rank': 1}]",,Future People,"subject: Documentary Films and Programs;creative_works: Future People: The Family of Donor 5114 (Movie);subject: ARTIFICIAL INSEMINATION;subject: Children and Childhood;persons: Rothman, Michael (Filmmaker);"
