,web_url,snippet,source,keywords,pub_date,word_count,headline.main,headline.kicker,headline.content_kicker,headline.print_headline,headline.name,headline.seo,headline.sub,byline.original,byline.person,byline.organization,title,Keywords
141,https://www.nytimes.com/2018/11/08/movies/in-a-relationship-review.html,"Sam Boyd’s gentle, loose-limbed romantic comedy wins no prizes for originality.",The New York Times,"[{'name': 'subject', 'value': 'Movies', 'rank': 1, 'major': 'N'}, {'name': 'persons', 'value': 'Roberts, Emma (1991- )', 'rank': 2, 'major': 'N'}, {'name': 'persons', 'value': 'ANGARANO, MICHAEL', 'rank': 3, 'major': 'N'}, {'name': 'persons', 'value': 'Hemingway, Dree (1987- )', 'rank': 4, 'major': 'N'}, {'name': 'creative_works', 'value': 'In a Relationship (Movie)', 'rank': 5, 'major': 'N'}, {'name': 'persons', 'value': 'Boyd, Sam (Film Director)', 'rank': 6, 'major': 'N'}]",2018-11-08T12:00:01+0000,253,‘In a Relationship’ Review: Two Couples at Opposite Stages of Love,,,In a Relationship,,,,By Jeannette Catsoulis,"[{'firstname': 'Jeannette', 'middlename': None, 'lastname': 'Catsoulis', 'qualifier': None, 'title': None, 'role': 'reported', 'organization': '', 'rank': 1}]",,In a Relationship,"subject: Movies;persons: Roberts, Emma (1991- );persons: ANGARANO, MICHAEL;persons: Hemingway, Dree (1987- );creative_works: In a Relationship (Movie);persons: Boyd, Sam (Film Director);"
142,https://www.nytimes.com/2018/11/01/movies/theyll-love-me-when-im-dead-review-documentary.html,Morgan Neville’s movie tells the tumultuous behind-the-scenes story of the making and near-unmaking of “The Other Side of the Wind.”,The New York Times,"[{'name': 'subject', 'value': 'Documentary Films and Programs', 'rank': 1, 'major': 'N'}, {'name': 'creative_works', 'value': ""They'll Love Me When I'm Dead (Movie)"", 'rank': 2, 'major': 'N'}, {'name': 'persons', 'value': 'Neville, Morgan', 'rank': 3, 'major': 'N'}, {'name': 'creative_works', 'value': 'The Other Side of the Wind (Movie)', 'rank': 4, 'major': 'N'}, {'name': 'persons', 'value': 'Welles, Orson', 'rank': 5, 'major': 'N'}]",2018-11-01T13:56:39+0000,794,Review: ‘They’ll Love Me When I’m Dead’ Documents Orson Welles’s Last Film,,,The Legend Behind The Scenes,,,,By Manohla Dargis,"[{'firstname': 'Manohla', 'middlename': None, 'lastname': 'Dargis', 'qualifier': None, 'title': None, 'role': 'reported', 'organization': '', 'rank': 1}]",,They’ll Love Me When I’m Dead’ Documents Orson Welles’s Last Fil,"subject: Documentary Films and Programs;creative_works: They'll Love Me When I'm Dead (Movie);persons: Neville, Morgan;creative_works: The Other Side of the Wind (Movie);persons: Welles, Orson;"
143,https://www.nytimes.com/2018/10/25/movies/burning-review.html,The great South Korean director Lee Chang-dong’s latest involves three characters subsumed by desire and rage.,The New York Times,"[{'name': 'subject', 'value': 'Movies', 'rank': 1, 'major': 'N'}, {'name': 'creative_works', 'value': 'Burning (Movie)', 'rank': 2, 'major': 'N'}, {'name': 'persons', 'value': 'Lee Chang-dong', 'rank': 3, 'major': 'N'}, {'name': 'persons', 'value': 'Yeun, Steven', 'rank': 4, 'major': 'N'}, {'name': 'persons', 'value': 'Murakami, Haruki', 'rank': 5, 'major': 'N'}]",2018-10-25T17:39:04+0000,949,"Review: In ‘Burning,’ Love Ignites a Divided World",,,Love Ignites a Divided World,,,,By Manohla Dargis,"[{'firstname': 'Manohla', 'middlename': None, 'lastname': 'Dargis', 'qualifier': None, 'title': None, 'role': 'reported', 'organization': '', 'rank': 1}]",,"Burning,’ Love Ignites a Divided Worl","subject: Movies;creative_works: Burning (Movie);persons: Lee Chang-dong;persons: Yeun, Steven;persons: Murakami, Haruki;"
144,https://www.nytimes.com/2018/10/11/movies/after-everything-review.html,This cancer drama focuses less on the high stakes of illness than on how two young people talk to each other in sickness and in health.,The New York Times,"[{'name': 'subject', 'value': 'Movies', 'rank': 1, 'major': 'N'}, {'name': 'creative_works', 'value': 'After Everything (Movie)', 'rank': 2, 'major': 'N'}, {'name': 'persons', 'value': 'White, Jeremy Allen', 'rank': 3, 'major': 'N'}, {'name': 'persons', 'value': 'Monroe, Maika', 'rank': 4, 'major': 'N'}]",2018-10-11T11:00:01+0000,268,"Review: In ‘After Everything,’ a Young Love Blooms in Crisis",,,After Everything,,,,By Teo Bugbee,"[{'firstname': 'Teo', 'middlename': None, 'lastname': 'Bugbee', 'qualifier': None, 'title': None, 'role': 'reported', 'organization': '', 'rank': 1}]",,"After Everything,’ a Young Love Blooms in Crisi","subject: Movies;creative_works: After Everything (Movie);persons: White, Jeremy Allen;persons: Monroe, Maika;"
145,https://www.nytimes.com/2018/09/20/movies/quincy-review-quincy-jones.html,"A documentary reveals its octogenarian subject as still busy and productive, and not a little haunted by memories of friends now gone.",The New York Times,"[{'name': 'creative_works', 'value': 'Quincy (Movie)', 'rank': 1, 'major': 'N'}, {'name': 'persons', 'value': 'Jones, Quincy', 'rank': 2, 'major': 'N'}, {'name': 'persons', 'value': 'Jones, Rashida', 'rank': 3, 'major': 'N'}, {'name': 'persons', 'value': 'Hicks, Alan', 'rank': 4, 'major': 'N'}, {'name': 'subject', 'value': 'Documentary Films and Programs', 'rank': 5, 'major': 'N'}, {'name': 'subject', 'value': 'Music', 'rank': 6, 'major': 'N'}, {'name': 'organizations', 'value': 'Netflix Inc', 'rank': 7, 'major': 'N'}]",2018-09-20T14:00:01+0000,460,Review: ‘Quincy’ Captures a Lifelong Love Affair With Music,,,The Man Behind the Music,,,,By Glenn Kenny,"[{'firstname': 'Glenn', 'middlename': None, 'lastname': 'Kenny', 'qualifier': None, 'title': None, 'role': 'reported', 'organization': '', 'rank': 1}]",,Quincy’ Captures a Lifelong Love Affair With Musi,"creative_works: Quincy (Movie);persons: Jones, Quincy;persons: Jones, Rashida;persons: Hicks, Alan;subject: Documentary Films and Programs;subject: Music;organizations: Netflix Inc;"
146,https://www.nytimes.com/2018/09/20/movies/love-gilda-review-saturday-night-live-documentary.html,"Adding to the booming genre of comedian documentaries, this film is an affectionate portrait of one of the first major stars of “Saturday Night Live.”",The New York Times,"[{'name': 'subject', 'value': 'Documentary Films and Programs', 'rank': 1, 'major': 'N'}, {'name': 'creative_works', 'value': 'Love, Gilda (Movie)', 'rank': 2, 'major': 'N'}, {'name': 'persons', 'value': 'Radner, Gilda', 'rank': 3, 'major': 'N'}, {'name': 'persons', 'value': ""D'Apolito, Lisa"", 'rank': 4, 'major': 'N'}, {'name': 'creative_works', 'value': 'Saturday Night Live (TV Program)', 'rank': 5, 'major': 'N'}, {'name': 'subject', 'value': 'Television', 'rank': 6, 'major': 'N'}, {'name': 'subject', 'value': 'Comedy and Humor', 'rank': 7, 'major': 'N'}]",2018-09-20T11:00:01+0000,421,"Review: In ‘Love, Gilda,’ a Portrait of a Brief and Brilliant Career",,,"Eccentric Charm, Raucous Abandon",,,,By Jason Zinoman,"[{'firstname': 'Jason', 'middlename': None, 'lastname': 'Zinoman', 'qualifier': None, 'title': None, 'role': 'reported', 'organization': '', 'rank': 1}]",,"Love, Gilda,’ a Portrait of a Brief and Brilliant Caree","subject: Documentary Films and Programs;creative_works: Love, Gilda (Movie);persons: Radner, Gilda;persons: D'Apolito, Lisa;creative_works: Saturday Night Live (TV Program);subject: Television;subject: Comedy and Humor;"
147,https://www.nytimes.com/2018/09/20/movies/tea-with-the-dames-review.html,"This documentary with a simple premise — Eileen Atkins, Judi Dench, Joan Plowright and Maggie Smith in conversation — delivers insight and gossip.",The New York Times,"[{'name': 'subject', 'value': 'Documentary Films and Programs', 'rank': 1, 'major': 'N'}, {'name': 'creative_works', 'value': 'Tea with the Dames (Movie)', 'rank': 2, 'major': 'N'}, {'name': 'persons', 'value': 'Dench, Judi', 'rank': 3, 'major': 'N'}, {'name': 'persons', 'value': 'Smith, Maggie', 'rank': 4, 'major': 'N'}, {'name': 'persons', 'value': 'Plowright, Joan', 'rank': 5, 'major': 'N'}, {'name': 'persons', 'value': 'Hebets, Eileen A', 'rank': 6, 'major': 'N'}, {'name': 'persons', 'value': 'Michell, Roger', 'rank': 7, 'major': 'N'}]",2018-09-20T11:00:01+0000,271,"Review: In ‘Tea With the Dames,’ Four Legends Dish on Acting and Love",,,Tea With the Dames,,,,By Glenn Kenny,"[{'firstname': 'Glenn', 'middlename': None, 'lastname': 'Kenny', 'qualifier': None, 'title': None, 'role': 'reported', 'organization': '', 'rank': 1}]",,"Tea With the Dames,’ Four Legends Dish on Acting and Lov","subject: Documentary Films and Programs;creative_works: Tea with the Dames (Movie);persons: Dench, Judi;persons: Smith, Maggie;persons: Plowright, Joan;persons: Hebets, Eileen A;persons: Michell, Roger;"
148,https://www.nytimes.com/2018/09/13/movies/bel-canto-review-julianne-moore.html,Julianne Moore plays an opera singer trapped in a South American mansion in this disappointingly passionless film.,The New York Times,"[{'name': 'subject', 'value': 'Movies', 'rank': 1, 'major': 'N'}, {'name': 'persons', 'value': 'Moore, Julianne', 'rank': 2, 'major': 'N'}, {'name': 'persons', 'value': 'Weitz, Paul', 'rank': 3, 'major': 'N'}, {'name': 'persons', 'value': 'Watanabe, Ken', 'rank': 4, 'major': 'N'}, {'name': 'creative_works', 'value': 'Bel Canto (Movie)', 'rank': 5, 'major': 'N'}]",2018-09-13T11:00:01+0000,464,"Review: In ‘Bel Canto,’ Music Is the Food of Love and Rebellion",,,This Hostage Can Hold a Tune,,,,By Jeannette Catsoulis,"[{'firstname': 'Jeannette', 'middlename': None, 'lastname': 'Catsoulis', 'qualifier': None, 'title': None, 'role': 'reported', 'organization': '', 'rank': 1}]",,"Bel Canto,’ Music Is the Food of Love and Rebellio","subject: Movies;persons: Moore, Julianne;persons: Weitz, Paul;persons: Watanabe, Ken;creative_works: Bel Canto (Movie);"
149,https://www.nytimes.com/2018/07/05/movies/the-citizen-review.html,"This Hungarian film is a careful, compassionate and beautifully acted character drama with a social conscience.",The New York Times,"[{'name': 'subject', 'value': 'Movies', 'rank': 1, 'major': 'N'}, {'name': 'creative_works', 'value': 'The Citizen (Movie)', 'rank': 2, 'major': 'N'}, {'name': 'persons', 'value': 'Vranik, Roland', 'rank': 3, 'major': 'N'}]",2018-07-05T12:00:01+0000,274,"Review: In ‘The Citizen,’ an Immigrant Picks a Bad Time to Fall in Love",,,The Citizen,,,,By Glenn Kenny,"[{'firstname': 'Glenn', 'middlename': None, 'lastname': 'Kenny', 'qualifier': None, 'title': None, 'role': 'reported', 'organization': '', 'rank': 1}]",,"The Citizen,’ an Immigrant Picks a Bad Time to Fall in Lov","subject: Movies;creative_works: The Citizen (Movie);persons: Vranik, Roland;"
150,https://www.nytimes.com/2018/06/28/movies/love-cecil-beaton-documentary-review.html,"Lisa Immordino Vreeland’s new documentary is about Cecil Beaton, the British dandy, photographer and theatrical designer.",The New York Times,"[{'name': 'subject', 'value': 'Documentary Films and Programs', 'rank': 1, 'major': 'N'}, {'name': 'creative_works', 'value': 'Love, Cecil (Movie)', 'rank': 2, 'major': 'N'}, {'name': 'persons', 'value': 'Beaton, Cecil', 'rank': 3, 'major': 'N'}, {'name': 'persons', 'value': 'Vreeland, Lisa Immordino', 'rank': 4, 'major': 'N'}]",2018-06-28T11:00:01+0000,293,"Review: In ‘Love, Cecil,’ an Aesthete Ahead of His Time",,,"Love, Cecil",,,,By Glenn Kenny,"[{'firstname': 'Glenn', 'middlename': None, 'lastname': 'Kenny', 'qualifier': None, 'title': None, 'role': 'reported', 'organization': '', 'rank': 1}]",,"Love, Cecil,’ an Aesthete Ahead of His Tim","subject: Documentary Films and Programs;creative_works: Love, Cecil (Movie);persons: Beaton, Cecil;persons: Vreeland, Lisa Immordino;"
151,https://www.nytimes.com/2018/05/24/movies/how-to-talk-to-girls-at-parties-review.html,John Cameron Mitchell’s loony romantic comedy encourages young love to bloom in the soil of an alien visitation.,The New York Times,"[{'name': 'subject', 'value': 'Movies', 'rank': 1, 'major': 'N'}, {'name': 'creative_works', 'value': 'How to Talk to Girls at Parties (Movie)', 'rank': 2, 'major': 'N'}, {'name': 'persons', 'value': 'Mitchell, John Cameron', 'rank': 3, 'major': 'N'}, {'name': 'persons', 'value': 'Fanning, Elle', 'rank': 4, 'major': 'N'}, {'name': 'persons', 'value': 'Sharp, Alexander', 'rank': 5, 'major': 'N'}]",2018-05-24T11:00:01+0000,458,Review: An Alien Teaches a Teenage Punk ‘How to Talk to Girls at Parties’,,,Otherworldly Love in a Punk-Rock World,,,,By Jeannette Catsoulis,"[{'firstname': 'Jeannette', 'middlename': None, 'lastname': 'Catsoulis', 'qualifier': None, 'title': None, 'role': 'reported', 'organization': '', 'rank': 1}]",,How to Talk to Girls at Parties,"subject: Movies;creative_works: How to Talk to Girls at Parties (Movie);persons: Mitchell, John Cameron;persons: Fanning, Elle;persons: Sharp, Alexander;"
152,https://www.nytimes.com/2018/04/26/movies/review-rogers-park.html,Two couples struggle to find serenity as middle age and its multiple discontents come breathing down their necks.,The New York Times,"[{'name': 'subject', 'value': 'Movies', 'rank': 1, 'major': 'N'}, {'name': 'creative_works', 'value': 'Rogers Park (Movie)', 'rank': 2, 'major': 'N'}, {'name': 'persons', 'value': 'Henry, Kyle', 'rank': 3, 'major': 'N'}]",2018-04-26T11:00:10+0000,325,"Review: In ‘Rogers Park,’ Life and Love in a Chicago Neighborhood",,,Rogers Park,,,,By Glenn Kenny,"[{'firstname': 'Glenn', 'middlename': None, 'lastname': 'Kenny', 'qualifier': None, 'title': None, 'role': 'reported', 'organization': '', 'rank': 1}]",,"Rogers Park,’ Life and Love in a Chicago Neighborhoo","subject: Movies;creative_works: Rogers Park (Movie);persons: Henry, Kyle;"
153,https://www.nytimes.com/2018/04/26/movies/love-and-bananas-review-asian-elephants.html,"In this personal movie, the actress Ashley Bell embarks on an elephant rescue in Thailand that also reveals the threats to the animal’s survival.",The New York Times,"[{'name': 'creative_works', 'value': 'Love & Bananas: An Elephant Story (Movie)', 'rank': 1, 'major': 'N'}, {'name': 'persons', 'value': 'Bell, Ashley (1986- )', 'rank': 2, 'major': 'N'}, {'name': 'subject', 'value': 'Elephants', 'rank': 3, 'major': 'N'}, {'name': 'subject', 'value': 'Animal Abuse, Rights and Welfare', 'rank': 4, 'major': 'N'}, {'name': 'subject', 'value': 'Documentary Films and Programs', 'rank': 5, 'major': 'N'}]",2018-04-26T11:00:01+0000,254,"Review: In ‘Love & Bananas,’ Uncovering the Plight of the Asian Elephant",,,Love &amp; Bananas: An Elephant Story,,,,By Glenn Kenny,"[{'firstname': 'Glenn', 'middlename': None, 'lastname': 'Kenny', 'qualifier': None, 'title': None, 'role': 'reported', 'organization': '', 'rank': 1}]",,"Love & Bananas,’ Uncovering the Plight of the Asian Elephan","creative_works: Love & Bananas: An Elephant Story (Movie);persons: Bell, Ashley (1986- );subject: Elephants;subject: Animal Abuse, Rights and Welfare;subject: Documentary Films and Programs;"
154,https://www.nytimes.com/2018/04/18/movies/godard-mon-amour-review.html,A portrait of a filmmaker in crisis that might have worked better as a comedy sketch.,The New York Times,"[{'name': 'subject', 'value': 'Movies', 'rank': 1, 'major': 'N'}, {'name': 'creative_works', 'value': 'Godard Mon Amour (Movie)', 'rank': 2, 'major': 'N'}, {'name': 'persons', 'value': 'Hazanavicius, Michel', 'rank': 3, 'major': 'N'}, {'name': 'persons', 'value': 'Godard, Jean-Luc', 'rank': 4, 'major': 'N'}, {'name': 'persons', 'value': 'Wiazemsky, Anne', 'rank': 5, 'major': 'N'}, {'name': 'persons', 'value': 'Garrel, Louis', 'rank': 6, 'major': 'N'}]",2018-04-18T23:02:46+0000,937,"Review: If You Love Godard, You’ll Hate-Watch ‘Godard Mon Amour’",,,"A Portrait and, for Some, a Hate-Watch",,,,By A.O. Scott,"[{'firstname': 'A.', 'middlename': 'O.', 'lastname': 'Scott', 'qualifier': None, 'title': None, 'role': 'reported', 'organization': '', 'rank': 1}]",,Godard Mon Amour,"subject: Movies;creative_works: Godard Mon Amour (Movie);persons: Hazanavicius, Michel;persons: Godard, Jean-Luc;persons: Wiazemsky, Anne;persons: Garrel, Louis;"
155,https://www.nytimes.com/2018/04/12/movies/submergence-review-wim-wenders.html,"In Wim Wenders’s film, Alicia Vikander and James McAvoy are soul mates who find each other before a plotline involving Somali jihadists separates them.",The New York Times,"[{'name': 'subject', 'value': 'Movies', 'rank': 1, 'major': 'N'}, {'name': 'creative_works', 'value': 'Submergence (Movie)', 'rank': 2, 'major': 'N'}, {'name': 'persons', 'value': 'Vikander, Alicia (1988- )', 'rank': 3, 'major': 'N'}, {'name': 'persons', 'value': 'McAvoy, James', 'rank': 4, 'major': 'N'}, {'name': 'persons', 'value': 'Wenders, Wim', 'rank': 5, 'major': 'N'}, {'name': 'persons', 'value': 'Ledgard, J M', 'rank': 6, 'major': 'N'}, {'name': 'persons', 'value': 'Dignam, Erin', 'rank': 7, 'major': 'N'}, {'name': 'subject', 'value': 'Books and Literature', 'rank': 8, 'major': 'N'}]",2018-04-12T11:00:01+0000,591,"Review: In ‘Submergence,’ a Love Story Sunk by Geopolitics",,,"They Find Each Other, Then Geopolitics Set In",,,,By Glenn Kenny,"[{'firstname': 'Glenn', 'middlename': None, 'lastname': 'Kenny', 'qualifier': None, 'title': None, 'role': 'reported', 'organization': '', 'rank': 1}]",,"Submergence,’ a Love Story Sunk by Geopolitic","subject: Movies;creative_works: Submergence (Movie);persons: Vikander, Alicia (1988- );persons: McAvoy, James;persons: Wenders, Wim;persons: Ledgard, J M;persons: Dignam, Erin;subject: Books and Literature;"
156,https://www.nytimes.com/2018/03/29/movies/love-after-love-review.html,Russ Harbaugh’s debut feature delivers something rarely seen in American movies: a warts-and-all examination of extended grief.,The New York Times,"[{'name': 'subject', 'value': 'Movies', 'rank': 1, 'major': 'N'}, {'name': 'creative_works', 'value': 'Love After Love (Movie)', 'rank': 2, 'major': 'N'}, {'name': 'persons', 'value': 'Harbaugh, Russ', 'rank': 3, 'major': 'N'}, {'name': 'persons', 'value': 'MacDowell, Andie', 'rank': 4, 'major': 'N'}]",2018-03-29T11:00:01+0000,280,"Review: In ‘Love After Love,’ an Unflinching Look at Extended Grief",,,Love After Love,,,,By Jeannette Catsoulis,"[{'firstname': 'Jeannette', 'middlename': None, 'lastname': 'Catsoulis', 'qualifier': None, 'title': None, 'role': 'reported', 'organization': '', 'rank': 1}]",,"Love After Love,’ an Unflinching Look at Extended Grie","subject: Movies;creative_works: Love After Love (Movie);persons: Harbaugh, Russ;persons: MacDowell, Andie;"
157,https://www.nytimes.com/2018/03/29/movies/outside-in-review-jay-duplass-edie-falco.html,Edie Falco and Jay Duplass connect romantically in this life-after-prison drama that prioritizes patience and pragmatism over passion.,The New York Times,"[{'name': 'subject', 'value': 'Movies', 'rank': 1, 'major': 'N'}, {'name': 'creative_works', 'value': 'Outside In (Movie)', 'rank': 2, 'major': 'N'}, {'name': 'persons', 'value': 'Shelton, Lynn', 'rank': 3, 'major': 'N'}, {'name': 'persons', 'value': 'Duplass, Jay', 'rank': 4, 'major': 'N'}, {'name': 'persons', 'value': 'Falco, Edie', 'rank': 5, 'major': 'N'}, {'name': 'persons', 'value': 'Dever, Kaitlyn', 'rank': 6, 'major': 'N'}]",2018-03-29T11:00:01+0000,422,Review: On Parole and in Love in ‘Outside In’,,,On Parole and in Love,,,,By Jeannette Catsoulis,"[{'firstname': 'Jeannette', 'middlename': None, 'lastname': 'Catsoulis', 'qualifier': None, 'title': None, 'role': 'reported', 'organization': '', 'rank': 1}]",,Outside In,"subject: Movies;creative_works: Outside In (Movie);persons: Shelton, Lynn;persons: Duplass, Jay;persons: Falco, Edie;persons: Dever, Kaitlyn;"
158,https://www.nytimes.com/2018/03/15/movies/love-simon-review.html,"This comedy set in a particularly idyllic Atlanta suburb has a gay love story, a blackmailing weasel and surprising emotional resonance.",The New York Times,"[{'name': 'subject', 'value': 'Movies', 'rank': 1, 'major': 'N'}, {'name': 'creative_works', 'value': 'Love, Simon (Movie)', 'rank': 2, 'major': 'N'}, {'name': 'persons', 'value': 'Berlanti, Greg', 'rank': 3, 'major': 'N'}, {'name': 'persons', 'value': 'Robinson, Nick (1995- )', 'rank': 4, 'major': 'N'}]",2018-03-15T17:26:47+0000,272,"Review: In ‘Love, Simon,’ a Glossy Teen Romance, the Hero Has a Secret",,,Coming Out Is Complicated,,,,By Glenn Kenny,"[{'firstname': 'Glenn', 'middlename': None, 'lastname': 'Kenny', 'qualifier': None, 'title': None, 'role': 'reported', 'organization': '', 'rank': 1}]",,"Love, Simon,’ a Glossy Teen Romance, the Hero Has a Secre","subject: Movies;creative_works: Love, Simon (Movie);persons: Berlanti, Greg;persons: Robinson, Nick (1995- );"
159,https://www.nytimes.com/2018/03/15/movies/keep-the-change-review.html,"A stubborn thirtysomething sentenced to spend time in an autism support group after an arrest finds romance, in this film starring actors with autism.",The New York Times,"[{'name': 'subject', 'value': 'Movies', 'rank': 1, 'major': 'N'}, {'name': 'creative_works', 'value': 'Keep the Change (Movie)', 'rank': 2, 'major': 'N'}, {'name': 'persons', 'value': 'Israel, Rachel', 'rank': 3, 'major': 'N'}]",2018-03-15T16:10:25+0000,258,"Review: In ‘Keep the Change,’ Two People With Autism Find Love",,,Keep the Change,,,,By Glenn Kenny,"[{'firstname': 'Glenn', 'middlename': None, 'lastname': 'Kenny', 'qualifier': None, 'title': None, 'role': 'reported', 'organization': '', 'rank': 1}]",,"Keep the Change,’ Two People With Autism Find Lov","subject: Movies;creative_works: Keep the Change (Movie);persons: Israel, Rachel;"
160,https://www.nytimes.com/2018/02/15/movies/the-party-review-timothy-spall-kristin-scott-thomas.html,Sally Potter directs a very fine cast in a would-be comedy about a calamitously bad evening.,The New York Times,"[{'name': 'subject', 'value': 'Movies', 'rank': 1, 'major': 'N'}, {'name': 'creative_works', 'value': 'The Party (Movie)', 'rank': 2, 'major': 'N'}, {'name': 'persons', 'value': 'Potter, Sally', 'rank': 3, 'major': 'N'}, {'name': 'persons', 'value': 'Spall, Timothy', 'rank': 4, 'major': 'N'}, {'name': 'persons', 'value': 'Scott Thomas, Kristin', 'rank': 5, 'major': 'N'}]",2018-02-15T12:00:25+0000,598,Review: A London Night Goes Wrong in ‘The Party’,,,"  Invite Company. Because After All, Misery Loves It.",,,,By Manohla Dargis,"[{'firstname': 'Manohla', 'middlename': None, 'lastname': 'Dargis', 'qualifier': None, 'title': None, 'role': 'reported', 'organization': '', 'rank': 1}]",,The Party,"subject: Movies;creative_works: The Party (Movie);persons: Potter, Sally;persons: Spall, Timothy;persons: Scott Thomas, Kristin;"
161,https://www.nytimes.com/2018/02/15/movies/the-housemaid-review.html,"Set in 1953, when the country was under French colonial rule, the story takes place on a plantation that harbors shameful secrets — and an apparition.",The New York Times,"[{'name': 'subject', 'value': 'Movies', 'rank': 1, 'major': 'N'}, {'name': 'glocations', 'value': 'Vietnam', 'rank': 2, 'major': 'N'}, {'name': 'persons', 'value': 'Nguyen, Derek', 'rank': 3, 'major': 'N'}, {'name': 'creative_works', 'value': 'The Housemaid (Movie)', 'rank': 4, 'major': 'N'}]",2018-02-15T12:00:02+0000,273,"Review: In ‘The Housemaid,’ Twisted Love and Angry Ghosts in Vietnam",,,The Housemaid,,,,By Jeannette Catsoulis,"[{'firstname': 'Jeannette', 'middlename': None, 'lastname': 'Catsoulis', 'qualifier': None, 'title': None, 'role': 'reported', 'organization': '', 'rank': 1}]",,"The Housemaid,’ Twisted Love and Angry Ghosts in Vietna","subject: Movies;glocations: Vietnam;persons: Nguyen, Derek;creative_works: The Housemaid (Movie);"
162,https://www.nytimes.com/2018/01/19/movies/forever-my-girl-review.html,There are few hard feelings in Bethany Ashton Wolf’s adaptation of a novel by Heidi McLaughlin.,The New York Times,"[{'name': 'subject', 'value': 'Movies', 'rank': 1, 'major': 'N'}, {'name': 'creative_works', 'value': 'Forever My Girl (Movie)', 'rank': 2, 'major': 'N'}, {'name': 'persons', 'value': 'Wolf, Bethany Ashton', 'rank': 3, 'major': 'N'}]",2018-01-19T17:22:06+0000,273,"Review: In ‘Forever My Girl,’ a Romance Resumes After a Long Break",,,Hitting  Pause On Love,,,,By Glenn Kenny,"[{'firstname': 'Glenn', 'middlename': None, 'lastname': 'Kenny', 'qualifier': None, 'title': None, 'role': 'reported', 'organization': '', 'rank': 1}]",,"Forever My Girl,’ a Romance Resumes After a Long Brea","subject: Movies;creative_works: Forever My Girl (Movie);persons: Wolf, Bethany Ashton;"
