,web_url,snippet,source,keywords,pub_date,word_count,headline.main,headline.kicker,headline.content_kicker,headline.print_headline,headline.name,headline.seo,headline.sub,byline.original,byline.person,byline.organization,title,Keywords
0,https://www.nytimes.com/2023/05/25/movies/the-attachment-diaries-review.html,"A gynecologist and her patient form a horrifyingly twisted connection in this batty, bloody Argentine melodrama.",The New York Times,"[{'name': 'subject', 'value': 'Movies', 'rank': 1, 'major': 'N'}, {'name': 'creative_works', 'value': 'The Attachment Diaries (Movie)', 'rank': 2, 'major': 'N'}, {'name': 'persons', 'value': 'Diment, Valentin Javier', 'rank': 3, 'major': 'N'}]",2023-05-25T11:00:03+0000,295,"‘The Attachment Diaries’ Review: Love, Sick",,,The Attachment Diaries,,,,By Jeannette Catsoulis,"[{'firstname': 'Jeannette', 'middlename': None, 'lastname': 'Catsoulis', 'qualifier': None, 'title': None, 'role': 'reported', 'organization': '', 'rank': 1}]",,The Attachment Diaries,"subject: Movies;creative_works: The Attachment Diaries (Movie);persons: Diment, Valentin Javier;"
1,https://www.nytimes.com/2023/05/04/movies/whats-love-got-to-do-with-it-review.html,Two childhood friends navigate cultural differences in this pleasantly uncontentious romantic comedy.,The New York Times,"[{'name': 'subject', 'value': 'Movies', 'rank': 1, 'major': 'N'}, {'name': 'persons', 'value': 'Kapur, Shekhar', 'rank': 2, 'major': 'N'}, {'name': 'persons', 'value': 'James, Lily', 'rank': 3, 'major': 'N'}, {'name': 'persons', 'value': 'Azmi, Shabana', 'rank': 4, 'major': 'N'}, {'name': 'persons', 'value': 'Thompson, Emma', 'rank': 5, 'major': 'N'}]",2023-05-04T17:16:45+0000,287,Review: ‘What’s Love Got to Do With It?’ Probably a Lot,,,What’s Love Got to Do With It?,,,,By Jeannette Catsoulis,"[{'firstname': 'Jeannette', 'middlename': None, 'lastname': 'Catsoulis', 'qualifier': None, 'title': None, 'role': 'reported', 'organization': '', 'rank': 1}]",,What’s Love Got to Do With It?’ Probably a Lo,"subject: Movies;persons: Kapur, Shekhar;persons: James, Lily;persons: Azmi, Shabana;persons: Thompson, Emma;"
2,https://www.nytimes.com/2023/05/04/movies/you-can-live-forever-review.html,Religion comes between two girls falling in love in the 1990s in this sweet coming-of-age film bathed in grunge hues.,The New York Times,"[{'name': 'subject', 'value': 'Movies', 'rank': 1, 'major': 'N'}, {'name': 'creative_works', 'value': 'You Can Live Forever (Movie)', 'rank': 2, 'major': 'N'}, {'name': 'persons', 'value': 'Slutsky, Mark', 'rank': 3, 'major': 'N'}, {'name': 'persons', 'value': 'Watts, Sarah (Film Director)', 'rank': 4, 'major': 'N'}, {'name': 'persons', 'value': ""O'Driscoll, Anwen"", 'rank': 5, 'major': 'N'}, {'name': 'persons', 'value': 'Laporte, June (Actor)', 'rank': 6, 'major': 'N'}]",2023-05-04T11:00:08+0000,294,‘You Can Live Forever’ Review: Do You Love Me Now?,,,You Can Live Forever,,,,By Elisabeth Vincentelli,"[{'firstname': 'Elisabeth', 'middlename': None, 'lastname': 'Vincentelli', 'qualifier': None, 'title': None, 'role': 'reported', 'organization': '', 'rank': 1}]",,You Can Live Forever,"subject: Movies;creative_works: You Can Live Forever (Movie);persons: Slutsky, Mark;persons: Watts, Sarah (Film Director);persons: O'Driscoll, Anwen;persons: Laporte, June (Actor);"
3,https://www.nytimes.com/2023/04/21/movies/a-tourists-guide-to-love-review.html,Rachael Leigh Cook stars in this bland rom-com as a travel executive exploring Vietnam and getting over a breakup.,The New York Times,"[{'name': 'subject', 'value': 'Movies', 'rank': 1, 'major': 'N'}, {'name': 'creative_works', 'value': ""A Tourist's Guide to Love (Movie)"", 'rank': 2, 'major': 'N'}, {'name': 'persons', 'value': 'Tsuchida, Steven', 'rank': 3, 'major': 'N'}, {'name': 'persons', 'value': 'Cook, Rachael Leigh', 'rank': 4, 'major': 'N'}]",2023-04-21T07:03:25+0000,276,‘A Tourist’s Guide to Love’ Review: A Wearyingly Familiar Trip,,,A Tourist’s  Guide to Love,,,,By Elisabeth Vincentelli,"[{'firstname': 'Elisabeth', 'middlename': None, 'lastname': 'Vincentelli', 'qualifier': None, 'title': None, 'role': 'reported', 'organization': '', 'rank': 1}]",,A Tourist’s Guide to Love,"subject: Movies;creative_works: A Tourist's Guide to Love (Movie);persons: Tsuchida, Steven;persons: Cook, Rachael Leigh;"
4,https://www.nytimes.com/2023/04/20/movies/other-peoples-children-review.html,"A radiant Virginie Efira stars as a Parisian teacher who blissfully falls for a man and his 4-year-old daughter, complicating everyone’s lives.",The New York Times,"[{'name': 'subject', 'value': 'Movies', 'rank': 1, 'major': 'N'}, {'name': 'persons', 'value': 'Zlotowski, Rebecca', 'rank': 2, 'major': 'N'}, {'name': 'creative_works', 'value': ""Other People's Children (Movie)"", 'rank': 3, 'major': 'N'}]",2023-04-20T15:35:13+0000,801,‘Other People’s Children’ Review: True Romance,Critic’s pick,,Intoxicating Love With a Sobering Turn,,,,By Manohla Dargis,"[{'firstname': 'Manohla', 'middlename': None, 'lastname': 'Dargis', 'qualifier': None, 'title': None, 'role': 'reported', 'organization': '', 'rank': 1}]",,Other People’s Children,"subject: Movies;persons: Zlotowski, Rebecca;creative_works: Other People's Children (Movie);"
5,https://www.nytimes.com/2023/04/13/movies/one-true-loves-movie-review.html,"A film adaptation of Taylor Jenkins Reid’s novel has potential for drama, but it stumbles on stock melodrama.",The New York Times,"[{'name': 'subject', 'value': 'Movies', 'rank': 1, 'major': 'N'}, {'name': 'persons', 'value': 'Bracey, Luke (1989- )', 'rank': 2, 'major': 'N'}, {'name': 'persons', 'value': 'Liu, Simu', 'rank': 3, 'major': 'N'}, {'name': 'persons', 'value': 'Reid, Taylor Jenkins', 'rank': 4, 'major': 'N'}, {'name': 'persons', 'value': 'Soo, Phillipa', 'rank': 5, 'major': 'N'}, {'name': 'persons', 'value': 'Fickman, Andy', 'rank': 6, 'major': 'N'}, {'name': 'creative_works', 'value': 'One True Loves (Movie)', 'rank': 7, 'major': 'N'}]",2023-04-13T11:00:06+0000,320,‘One True Loves’ Review: A Romance Lost at Sea,,,One True Loves,,,,By Brandon Yu,"[{'firstname': 'Brandon', 'middlename': None, 'lastname': 'Yu', 'qualifier': None, 'title': None, 'role': 'reported', 'organization': '', 'rank': 1}]",,One True Loves,"subject: Movies;persons: Bracey, Luke (1989- );persons: Liu, Simu;persons: Reid, Taylor Jenkins;persons: Soo, Phillipa;persons: Fickman, Andy;creative_works: One True Loves (Movie);"
6,https://www.nytimes.com/2023/04/13/movies/the-lost-weekend-a-love-story-review.html,"There’s not much Lennon music heard in this doc about his affair with May Pang, and given how much Pang trashes his wife, Yoko Ono, it’s no surprise it was withheld.",The New York Times,"[{'name': 'subject', 'value': 'Documentary Films and Programs', 'rank': 1, 'major': 'N'}, {'name': 'creative_works', 'value': 'The Lost Weekend: A Love Story (Movie)', 'rank': 2, 'major': 'N'}, {'name': 'persons', 'value': 'Pang, May', 'rank': 3, 'major': 'N'}, {'name': 'persons', 'value': 'Lennon, John', 'rank': 4, 'major': 'N'}, {'name': 'persons', 'value': 'Ono, Yoko', 'rank': 5, 'major': 'N'}, {'name': 'persons', 'value': 'Brandstein, Eve', 'rank': 6, 'major': 'N'}, {'name': 'persons', 'value': 'Kaufman, Richard S (Filmmaker)', 'rank': 7, 'major': 'N'}, {'name': 'persons', 'value': 'Samuels, Stuart (Filmmaker)', 'rank': 8, 'major': 'N'}, {'name': 'subject', 'value': 'Content Type: Personal Profile', 'rank': 9, 'major': 'N'}, {'name': 'subject', 'value': 'Pop and Rock Music', 'rank': 10, 'major': 'N'}]",2023-04-13T11:00:03+0000,327,‘The Lost Weekend: A Love Story’ Review: When John Lennon Strayed,,,The Lost Weekend:  A Love Story,,,,By Glenn Kenny,"[{'firstname': 'Glenn', 'middlename': None, 'lastname': 'Kenny', 'qualifier': None, 'title': None, 'role': 'reported', 'organization': '', 'rank': 1}]",,The Lost Weekend: A Love Story,"subject: Documentary Films and Programs;creative_works: The Lost Weekend: A Love Story (Movie);persons: Pang, May;persons: Lennon, John;persons: Ono, Yoko;persons: Brandstein, Eve;persons: Kaufman, Richard S (Filmmaker);persons: Samuels, Stuart (Filmmaker);subject: Content Type: Personal Profile;subject: Pop and Rock Music;"
7,https://www.nytimes.com/2023/03/30/movies/a-thousand-and-one-review.html,"A mesmerizing Teyana Taylor stars in A.V. Rockwell’s feature directing debut, about motherhood and survival in a fast-changing city.",The New York Times,"[{'name': 'subject', 'value': 'Movies', 'rank': 1, 'major': 'N'}, {'name': 'creative_works', 'value': 'A Thousand and One (Movie)', 'rank': 2, 'major': 'N'}, {'name': 'persons', 'value': 'Rockwell, AV (Film Director)', 'rank': 3, 'major': 'N'}, {'name': 'persons', 'value': 'Taylor, Teyana (1990- )', 'rank': 4, 'major': 'N'}]",2023-03-30T18:53:42+0000,971,‘A Thousand and One’ Review: A New York Love Story,Critic’s Pick,,An Unbending Will Meets a Shifting City,,,,By Manohla Dargis,"[{'firstname': 'Manohla', 'middlename': None, 'lastname': 'Dargis', 'qualifier': None, 'title': None, 'role': 'reported', 'organization': '', 'rank': 1}]",,A Thousand and One,"subject: Movies;creative_works: A Thousand and One (Movie);persons: Rockwell, AV (Film Director);persons: Taylor, Teyana (1990- );"
8,https://www.nytimes.com/2023/02/09/movies/your-place-or-mine-review.html,This humdrum Netflix romantic comedy features Reese Witherspoon and Ashton Kutcher as longtime friends with possibly hidden feelings for each other.,The New York Times,"[{'name': 'subject', 'value': 'Movies', 'rank': 1, 'major': 'N'}, {'name': 'creative_works', 'value': 'Your Place or Mine (Movie)', 'rank': 2, 'major': 'N'}, {'name': 'persons', 'value': 'Witherspoon, Reese', 'rank': 3, 'major': 'N'}, {'name': 'persons', 'value': 'Kutcher, Ashton', 'rank': 4, 'major': 'N'}, {'name': 'persons', 'value': 'McKenna, Aline Brosh', 'rank': 5, 'major': 'N'}]",2023-02-10T00:00:05+0000,569,‘Your Place or Mine’ Review: Try Neither,,,They Have a Humdrum Kind of Love,,,,By Amy Nicholson,"[{'firstname': 'Amy', 'middlename': None, 'lastname': 'Nicholson', 'qualifier': None, 'title': None, 'role': 'reported', 'organization': '', 'rank': 1}]",,Your Place or Mine,"subject: Movies;creative_works: Your Place or Mine (Movie);persons: Witherspoon, Reese;persons: Kutcher, Ashton;persons: McKenna, Aline Brosh;"
9,https://www.nytimes.com/2023/02/02/movies/love-in-the-time-of-fentanyl-review.html,"To combat the overdose crisis, a group that includes former and current users open a safe consumption site where shooting up does not have to mean death.",The New York Times,"[{'name': 'subject', 'value': 'Documentary Films and Programs', 'rank': 1, 'major': 'N'}, {'name': 'subject', 'value': 'Fentanyl', 'rank': 2, 'major': 'N'}, {'name': 'subject', 'value': 'Drug Abuse and Traffic', 'rank': 3, 'major': 'N'}, {'name': 'subject', 'value': 'Volunteers and Community Service', 'rank': 4, 'major': 'N'}, {'name': 'creative_works', 'value': 'Love in the Time of Fentanyl (Movie)', 'rank': 5, 'major': 'N'}, {'name': 'persons', 'value': 'Askey, Colin', 'rank': 6, 'major': 'N'}, {'name': 'glocations', 'value': 'Vancouver (British Columbia)', 'rank': 7, 'major': 'N'}, {'name': 'organizations', 'value': 'Overdose Prevention Society', 'rank': 8, 'major': 'N'}]",2023-02-02T12:00:11+0000,306,"‘Love in the Time of Fentanyl’ Review: Heartbreak, Death and Hope in Vancouver",,,Love in the Time Of Fentanyl,,,,By Concepción de León,"[{'firstname': 'Concepción', 'middlename': None, 'lastname': 'de León', 'qualifier': None, 'title': None, 'role': 'reported', 'organization': '', 'rank': 1}]",,Love in the Time of Fentanyl,"subject: Documentary Films and Programs;subject: Fentanyl;subject: Drug Abuse and Traffic;subject: Volunteers and Community Service;creative_works: Love in the Time of Fentanyl (Movie);persons: Askey, Colin;glocations: Vancouver (British Columbia);organizations: Overdose Prevention Society;"
10,https://www.nytimes.com/2023/01/31/movies/pamela-a-love-story-review.html,"This documentary from Ryan White rewinds, to powerful effect, on Pamela Anderson’s life and fame.",The New York Times,"[{'name': 'subject', 'value': 'Documentary Films and Programs', 'rank': 1, 'major': 'N'}, {'name': 'persons', 'value': 'Anderson, Pamela (1967- )', 'rank': 2, 'major': 'N'}, {'name': 'persons', 'value': 'White, Ryan (Filmmaker)', 'rank': 3, 'major': 'N'}, {'name': 'creative_works', 'value': 'Pamela, a Love Story (Movie)', 'rank': 4, 'major': 'N'}]",2023-01-31T12:00:05+0000,295,"‘Pamela, a Love Story’ Review: A Frank Look Back",,,"Pamela, a Love Story",,,,By Glenn Kenny,"[{'firstname': 'Glenn', 'middlename': None, 'lastname': 'Kenny', 'qualifier': None, 'title': None, 'role': 'reported', 'organization': '', 'rank': 1}]",,"Pamela, a Love Story","subject: Documentary Films and Programs;persons: Anderson, Pamela (1967- );persons: White, Ryan (Filmmaker);creative_works: Pamela, a Love Story (Movie);"
11,https://www.nytimes.com/2023/01/19/movies/in-from-the-side-review.html,"In Matt Carter’s gay rugby film, sports and romance smash together like two players from opposing teams.",The New York Times,"[{'name': 'subject', 'value': 'Movies', 'rank': 1, 'major': 'N'}, {'name': 'creative_works', 'value': 'In From the Side (Movie)', 'rank': 2, 'major': 'N'}, {'name': 'persons', 'value': 'Carter, Matt (Filmmaker)', 'rank': 3, 'major': 'N'}]",2023-01-19T17:50:16+0000,281,‘In From the Side’ Review: Love and Rugby Play a Losing Game,,,In From the Side,,,,By Kyle Turner,"[{'firstname': 'Kyle', 'middlename': None, 'lastname': 'Turner', 'qualifier': None, 'title': None, 'role': 'reported', 'organization': '', 'rank': 1}]",,In From the Side,"subject: Movies;creative_works: In From the Side (Movie);persons: Carter, Matt (Filmmaker);"
12,https://www.nytimes.com/2023/01/19/movies/after-love-review.html,"In this intelligent melodrama by the director Aleem Khan, a British woman discovers her husband has been leading a double life.",The New York Times,"[{'name': 'subject', 'value': 'Movies', 'rank': 1, 'major': 'N'}, {'name': 'creative_works', 'value': 'After Love (2020) (Movie)', 'rank': 2, 'major': 'N'}, {'name': 'persons', 'value': 'Khan, Aleem', 'rank': 3, 'major': 'N'}, {'name': 'persons', 'value': 'Scanlan, Joanna (1961- )', 'rank': 4, 'major': 'N'}]",2023-01-19T12:00:06+0000,359,‘After Love’ Review: The Other Woman,Critic’s Pick,,After Love,,,,By Beatrice Loayza,"[{'firstname': 'Beatrice', 'middlename': None, 'lastname': 'Loayza', 'qualifier': None, 'title': None, 'role': 'reported', 'organization': '', 'rank': 1}]",,After Love,"subject: Movies;creative_works: After Love (2020) (Movie);persons: Khan, Aleem;persons: Scanlan, Joanna (1961- );"
13,https://www.nytimes.com/2023/01/05/movies/alcarras-review.html,"In this naturalistic drama from Spain, a family confronts the impending loss of its generations-old farm.",The New York Times,"[{'name': 'subject', 'value': 'Movies', 'rank': 1, 'major': 'N'}, {'name': 'persons', 'value': 'Simon, Carla', 'rank': 2, 'major': 'N'}, {'name': 'creative_works', 'value': 'Alcarras (Movie)', 'rank': 3, 'major': 'N'}]",2023-01-05T12:00:03+0000,306,‘Alcarràs’ Review: Labor of Love,,,Alcarràs,,,,By Devika Girish,"[{'firstname': 'Devika', 'middlename': None, 'lastname': 'Girish', 'qualifier': None, 'title': None, 'role': 'reported', 'organization': '', 'rank': 1}]",,Alcarràs,"subject: Movies;persons: Simon, Carla;creative_works: Alcarras (Movie);"
14,https://www.nytimes.com/2022/12/15/movies/nelly-and-nadine-review.html,A family archive provides intimate records of a love affair that began between two women imprisoned in the Ravensbrück concentration camp.,The New York Times,"[{'name': 'subject', 'value': 'Documentary Films and Programs', 'rank': 1, 'major': 'N'}, {'name': 'persons', 'value': 'Gertten, Magnus', 'rank': 2, 'major': 'N'}, {'name': 'creative_works', 'value': 'Nelly & Nadine (Movie)', 'rank': 3, 'major': 'N'}, {'name': 'subject', 'value': 'Content Type: Personal Profile', 'rank': 4, 'major': 'N'}, {'name': 'subject', 'value': 'Holocaust and the Nazi Era', 'rank': 5, 'major': 'N'}, {'name': 'subject', 'value': 'World War II (1939-45)', 'rank': 6, 'major': 'N'}, {'name': 'subject', 'value': 'Women and Girls', 'rank': 7, 'major': 'N'}, {'name': 'subject', 'value': 'Homosexuality and Bisexuality', 'rank': 8, 'major': 'N'}]",2022-12-15T12:00:04+0000,308,"‘Nelly & Nadine’ Review: An Unlikely Love, an Unlikely Record",,,Nelly &amp; Nadine,,,,By Teo Bugbee,"[{'firstname': 'Teo', 'middlename': None, 'lastname': 'Bugbee', 'qualifier': None, 'title': None, 'role': 'reported', 'organization': '', 'rank': 1}]",,Nelly & Nadine,"subject: Documentary Films and Programs;persons: Gertten, Magnus;creative_works: Nelly & Nadine (Movie);subject: Content Type: Personal Profile;subject: Holocaust and the Nazi Era;subject: World War II (1939-45);subject: Women and Girls;subject: Homosexuality and Bisexuality;"
15,https://www.nytimes.com/2022/12/01/movies/lady-chatterleys-lover-review.html,The new Netflix adaptation of D.H. Lawrence’s once-controversial novel is both steamy and decorous.,The New York Times,"[{'name': 'subject', 'value': 'Movies', 'rank': 1, 'major': 'N'}, {'name': 'creative_works', 'value': ""Lady Chatterley's Lover (Movie)"", 'rank': 2, 'major': 'N'}, {'name': 'persons', 'value': 'Corrin, Emma (1995- )', 'rank': 3, 'major': 'N'}, {'name': 'persons', 'value': 'De Clermont-Tonnerre, Laure', 'rank': 4, 'major': 'N'}, {'name': 'persons', 'value': 'Lawrence, D H', 'rank': 5, 'major': 'N'}]",2022-12-01T16:40:55+0000,768,‘Lady Chatterley’s Lover’ Review: When Connie Met Ollie,,,A Love Whose Name Is Often Spoken,,,,By A.O. Scott,"[{'firstname': 'A.', 'middlename': 'O.', 'lastname': 'Scott', 'qualifier': None, 'title': None, 'role': 'reported', 'organization': '', 'rank': 1}]",,Lady Chatterley’s Lover,"subject: Movies;creative_works: Lady Chatterley's Lover (Movie);persons: Corrin, Emma (1995- );persons: De Clermont-Tonnerre, Laure;persons: Lawrence, D H;"
16,https://www.nytimes.com/2022/11/23/movies/sound-of-christmas-review.html,A young singer gets more than she bargained for when she accepts a job as a nanny for a billionaire’s children.,The New York Times,"[{'name': 'subject', 'value': 'Movies', 'rank': 1, 'major': 'N'}, {'name': 'persons', 'value': 'Ne-Yo', 'rank': 2, 'major': 'N'}, {'name': 'creative_works', 'value': 'The Sound of Christmas (Movie)', 'rank': 3, 'major': 'N'}, {'name': 'persons', 'value': 'Mattison, Booker T', 'rank': 4, 'major': 'N'}, {'name': 'persons', 'value': 'McNeill, Serayah', 'rank': 5, 'major': 'N'}]",2022-11-23T15:00:09+0000,277,‘The Sound of Christmas’ Review: A Gospel Singer Finds Love,,,The Sound  Of Christmas,,,,By Concepción de León,"[{'firstname': 'Concepción', 'middlename': None, 'lastname': 'de León', 'qualifier': None, 'title': None, 'role': 'reported', 'organization': '', 'rank': 1}]",,The Sound of Christmas,"subject: Movies;persons: Ne-Yo;creative_works: The Sound of Christmas (Movie);persons: Mattison, Booker T;persons: McNeill, Serayah;"
17,https://www.nytimes.com/2022/11/17/movies/the-inspection-review-boot-camp-a-love-story.html,"Elegance Bratton’s autobiographical first feature is a lyrical, wrenching look at a young Marine’s journey through basic training.",The New York Times,"[{'name': 'subject', 'value': 'Movies', 'rank': 1, 'major': 'N'}, {'name': 'creative_works', 'value': 'The Inspection (Movie)', 'rank': 2, 'major': 'N'}, {'name': 'persons', 'value': 'Bratton, Elegance', 'rank': 3, 'major': 'N'}]",2022-11-17T12:00:07+0000,836,"‘The Inspection’ Review: Boot Camp, a Love Story",critic’s pick,,"A Few Good Men, Some With Secrets",,,,By A.O. Scott,"[{'firstname': 'A.', 'middlename': 'O.', 'lastname': 'Scott', 'qualifier': None, 'title': None, 'role': 'reported', 'organization': '', 'rank': 1}]",,The Inspection,"subject: Movies;creative_works: The Inspection (Movie);persons: Bratton, Elegance;"
18,https://www.nytimes.com/2022/11/17/movies/bones-and-all-review.html,Luca Guadagnino’s latest stars Timothée Chalamet and Taylor Russell as young cannibals on the run.,The New York Times,"[{'name': 'subject', 'value': 'Movies', 'rank': 1, 'major': 'N'}, {'name': 'creative_works', 'value': 'Bones and All (Movie)', 'rank': 2, 'major': 'N'}, {'name': 'persons', 'value': 'Guadagnino, Luca', 'rank': 3, 'major': 'N'}, {'name': 'persons', 'value': 'Chalamet, Timothee (1995- )', 'rank': 4, 'major': 'N'}, {'name': 'persons', 'value': 'Russell, Taylor (1994- )', 'rank': 5, 'major': 'N'}]",2022-11-17T12:00:06+0000,710,‘Bones and All’ Review: You Eat What You Are,,,"It’s Eat, Prey, Love on a Journey of Self-Discovery",,,,By A.O. Scott,"[{'firstname': 'A.', 'middlename': 'O.', 'lastname': 'Scott', 'qualifier': None, 'title': None, 'role': 'reported', 'organization': '', 'rank': 1}]",,Bones and All,"subject: Movies;creative_works: Bones and All (Movie);persons: Guadagnino, Luca;persons: Chalamet, Timothee (1995- );persons: Russell, Taylor (1994- );"
19,https://www.nytimes.com/2022/10/20/movies/my-policeman-review.html,"A schoolteacher, her police officer husband and his lover deny each other romantic satisfaction in this dismal melodrama.",The New York Times,"[{'name': 'subject', 'value': 'Movies', 'rank': 1, 'major': 'N'}, {'name': 'creative_works', 'value': 'My Policeman (Movie)', 'rank': 2, 'major': 'N'}, {'name': 'persons', 'value': 'Grandage, Michael', 'rank': 3, 'major': 'N'}]",2022-10-20T16:52:51+0000,303,"‘My Policeman’ Review: Two Love Affairs, Equally Tragic",,,My Policeman,,,,By Teo Bugbee,"[{'firstname': 'Teo', 'middlename': None, 'lastname': 'Bugbee', 'qualifier': None, 'title': None, 'role': 'reported', 'organization': '', 'rank': 1}]",,My Policeman,"subject: Movies;creative_works: My Policeman (Movie);persons: Grandage, Michael;"
20,https://www.nytimes.com/2022/09/08/movies/about-fate-review.html,"Thomas Mann’s beguiling performance drives this Emma Roberts vehicle, but the romantic comedy creaks under the weight of its coincidences.",The New York Times,"[{'name': 'subject', 'value': 'Movies', 'rank': 1, 'major': 'N'}, {'name': 'creative_works', 'value': 'About Fate (Movie)', 'rank': 2, 'major': 'N'}, {'name': 'persons', 'value': 'Vaysberg, Marius', 'rank': 3, 'major': 'N'}, {'name': 'persons', 'value': 'Mann, Thomas (1991- )', 'rank': 4, 'major': 'N'}, {'name': 'persons', 'value': 'Roberts, Emma (1991- )', 'rank': 5, 'major': 'N'}]",2022-09-09T01:00:03+0000,289,‘About Fate’ Review: Love the One You’re With?,,,About Fate,,,,By Lisa Kennedy,"[{'firstname': 'Lisa', 'middlename': None, 'lastname': 'Kennedy', 'qualifier': None, 'title': None, 'role': 'reported', 'organization': '', 'rank': 1}]",,About Fate,"subject: Movies;creative_works: About Fate (Movie);persons: Vaysberg, Marius;persons: Mann, Thomas (1991- );persons: Roberts, Emma (1991- );"
21,https://www.nytimes.com/2022/09/01/movies/waiting-for-bojangles-review-endless-love.html,"Set in Paris in the 1960s, the film tells the story of two irrepressible lovers, and their young son, whose tale turns tragic.",The New York Times,"[{'name': 'subject', 'value': 'Movies', 'rank': 1, 'major': 'N'}, {'name': 'persons', 'value': 'Bourdeaut, Olivier', 'rank': 2, 'major': 'N'}, {'name': 'creative_works', 'value': 'Waiting for Bojangles (Movie)', 'rank': 3, 'major': 'N'}, {'name': 'persons', 'value': 'Roinsard, Regis', 'rank': 4, 'major': 'N'}]",2022-09-01T11:00:06+0000,267,‘Waiting for Bojangles’ Review: Endless Love,,,Waiting for Bojangles,,,,By Calum Marsh,"[{'firstname': 'Calum', 'middlename': None, 'lastname': 'Marsh', 'qualifier': None, 'title': None, 'role': 'reported', 'organization': '', 'rank': 1}]",,Waiting for Bojangles,"subject: Movies;persons: Bourdeaut, Olivier;creative_works: Waiting for Bojangles (Movie);persons: Roinsard, Regis;"
22,https://www.nytimes.com/2022/08/04/movies/i-love-my-dad-review.html,This comedy is a daddy-issues movie with a queasy premise truly made for these times.,The New York Times,"[{'name': 'subject', 'value': 'Movies', 'rank': 1, 'major': 'N'}, {'name': 'persons', 'value': 'Oswalt, Patton', 'rank': 2, 'major': 'N'}, {'name': 'creative_works', 'value': 'I Love My Dad (Movie)', 'rank': 3, 'major': 'N'}, {'name': 'persons', 'value': 'Morosini, James', 'rank': 4, 'major': 'N'}]",2022-08-04T11:00:05+0000,418,‘I Love My Dad’ Review: A Father Catfishes His Son,,,A Father Catfishes His Son. We Just Wait for the Ick.,,,,By Glenn Kenny,"[{'firstname': 'Glenn', 'middlename': None, 'lastname': 'Kenny', 'qualifier': None, 'title': None, 'role': 'reported', 'organization': '', 'rank': 1}]",,I Love My Dad,"subject: Movies;persons: Oswalt, Patton;creative_works: I Love My Dad (Movie);persons: Morosini, James;"
23,https://www.nytimes.com/2022/07/28/movies/a-love-song-review.html,Two former childhood friends rekindle their connection in this sweetly hopeful story of romantic longing.,The New York Times,"[{'name': 'subject', 'value': 'Movies', 'rank': 1, 'major': 'N'}, {'name': 'creative_works', 'value': 'A Love Song (Movie)', 'rank': 2, 'major': 'N'}, {'name': 'persons', 'value': 'Walker-Silverman, Max', 'rank': 3, 'major': 'N'}, {'name': 'persons', 'value': 'Dickey, Dale (Actor)', 'rank': 4, 'major': 'N'}, {'name': 'persons', 'value': 'STUDI, WES', 'rank': 5, 'major': 'N'}]",2022-07-28T11:00:06+0000,395,‘A Love Song’ Review: When Moving Forward Means Looking Back,Critic’s Pick,,The Romantic Ache That Never Truly Dies,,,,By Jeannette Catsoulis,"[{'firstname': 'Jeannette', 'middlename': None, 'lastname': 'Catsoulis', 'qualifier': None, 'title': None, 'role': 'reported', 'organization': '', 'rank': 1}]",,A Love Song,"subject: Movies;creative_works: A Love Song (Movie);persons: Walker-Silverman, Max;persons: Dickey, Dale (Actor);persons: STUDI, WES;"
